,Character,Dialog
0,Tony Stark,Shit!
1,Steve Rogers,"Language! JARVIS, what's the view from upstairs?"
2,JARVIS,The central building is protected by some kind of energy shield. Strucker's technology is well beyond any other Hydra base we've taken.
3,Thor,Loki's scepter must be here. Strucker couldn't mount this defense without it. At long last.
4,Natasha Romanoff,"At long last is lasting a little long, boys."
5,Clint Barton,Yeah. I think we lost the element of surprise.
6,Tony Stark,"Wait a second. No one else is going to deal with the fact that Cap just said ""language?"""
7,Steve Rogers,I know.
8,Steve Rogers,It just slipped out.
9,Strucker,Who gave the order to attack?
10,Fortress Soldier,"Herr Strucker, it's the Avengers. They landed in the far woods, the perimeter guard panicked."
11,Strucker,Can we hold them?
12,Fortress Soldier,They're the Avengers...
13,Strucker,Deploy the rest of the tanks.
14,Fortress Soldier,"Yes, sir."
15,Strucker,Concentrate fire on the weak ones. A hit can make them close ranks. Everything we've accomplished. But we're on the verge of our greatest breakthrough.
16,Dr. List,Then let's show them what we've accomplished. Send out the twins.
17,Strucker,It's too soon.
18,Dr. List,It's what they signed up for.
19,Strucker,My men can hold them.
20,Jarvis,"Sir, the city is taking fire."
21,Tony Stark,"Well, we know Strucker's not going to worry about civilian casualties. Send in the Iron Legion."
22,Iron Legion,This quadrant is unsafe. Please back away. We are here to help. This quadrant is unsafe. Please back away. Please back away. We wish to avoid collateral damage and will inform you when this current conflict is resolved. We are here to help.
23,Iron Legion,We are here to help.
24,Strucker,"We will not yield! The Americans sent their circus freaks to test us. We will send them back, in bags. No Surrender!"
25,Soldiers,No Surrender!
26,Strucker,"I am going to surrender. You will delete everything. If we give the Avengers the weapons, they may not look too far into what we've been..."
27,Dr. List,The twins.
28,Strucker,They are not ready to take on...
29,Dr. List,"No, no. I mean..."
30,Dr. List,The Twins.
31,Pietro Maximoff,You didn't see that coming?
32,Natasha Romanoff,Clint!
33,Steve Rogers,We have an enhanced in the field.
34,Natasha Romanoff,Clint's hit!
35,Natasha Romanoff,Somebody want to deal with that bunker?
36,Natasha Romanoff,Thank you.
37,Steve Rogers,"Stark, we're really need to get inside."
38,Tony Stark,"I'm closing in. JARVIS, am I...closing in? Do you see a power source for that shield?"
39,JARVIS,There's a pathway below the north tower.
40,Tony Stark,"Great, I wanna poke it with something."
41,Tony Stark,"Drawbridge is down, people."
42,Thor,The enhanced?
43,Steve Rogers,"He's a blur. All the new player's we've faced, I've never seen this. In fact, I still haven't."
44,Natasha Romanoff,"Clint's hit pretty bad, guys. We're gonna need evac."
45,Thor,I can get Barton to the jet. The sooner we're gone the better. You and Stark secure the scepter.
46,Steve Rogers,Copy that.
47,Thor,Looks like they're lining up.
48,Steve Rogers,"Well, they're excited."
49,Thor,Find the scepter.
50,Tony Stark,"And for gosh sake, watch your language!"
51,Steve Rogers,That's not going away anytime soon.
52,Tony Stark,"Guys, stop, we gotta talk about this."
53,Tony Stark,Good talk.
54,Fortress Soldier,No it wasn't.
55,Tony Stark,Sentry mode.
56,Tony Stark,"Okay, JARVIS. You know I want it all. Make sure you copy Hill at HQ."
57,Natasha Romanoff,We're locked down out here.
58,Steve Rogers,"Then get to Banner, time for a lullaby."
59,Tony Stark,"I know you're hiding more than files. Hey, J, give me an IR scan of the room, real quick."
60,JARVIS,The wall to your left...I'm reading steel reinforcement and an air current.
61,Tony Stark,"Please be a secret door, please be a secret door, please be a secret door..."
62,Tony Stark,Yay!
63,Natasha Romanoff,"Hey, big guy. The sun's getting real low."
64,Steve Rogers,Baron Strucker. Hydra's number one thug.
65,Strucker,"Technically, I'm a thug for SHIELD."
66,Steve Rogers,Well then technically you're unemployed. Where's Loki's scepter?
67,Strucker,"Don't worry, I know when I'm beat. You'll mention how I cooperated, I hope."
68,Steve Rogers,I'll put it right under illegal human experimentation.
69,Steve,Rogers: How many are there?
70,Steve Rogers,We have a second enhanced. Female. Do not engage.
71,Strucker,You'll have to be faster than...
72,Steve Rogers,"Guys, I got Strucker."
73,Tony Stark,"Yeah, I got...something bigger."
74,Tony Stark,"Thor, I got eyes on the prize."
75,Steve Rogers,You could have saved us.
76,Steve Rogers,Why didn't you do more?
77,Pietro Maximoff,We're just gonna let them take it?
78,Natasha Romanoff,"Hey, the lullaby worked better than ever."
79,Bruce Banner,Just wasn't expecting the Code Green.
80,Natasha Romanoff,"If you hadn't been there, there would've been double the casualties. My best friend would've been a treasured memory."
81,Bruce Banner,"You know, sometimes exactly what I want to hear isn't exactly what I want to hear."
82,Natasha Romanoff,How long before you trust me?
83,Bruce Banner,It's not you I don't trust.
84,Natasha Romanoff,"Thor, report on the Hulk?"
85,Thor,The gates of Hell are filled with the screams of his victims.
86,Thor,"Uh, but, not the screams of the dead, of course. No no, uh...wounded screams, mainly whimpering, a great deal of complaining and tales of sprained deltoids and, and uh... and gout."
87,Tony Stark,"Hey Banner, Dr. Cho's on her way in from Seoul, is it okay if she sets up in your lab?"
88,Bruce Banner,"Uh, yeah, she knows her way around."
89,Tony Stark,"Thanks.  Tell her to prep everything, Barton's gonna need the full treatment."
90,JARVIS,Very good sir.
91,Tony Stark,"JARVIS, take the wheel."
92,JARVIS,"Yes, sir. Approach vector is locked."
93,Tony Stark,"It feels good, yeah? I mean, you've been after this thing since SHIELD collapsed. Not that I haven't enjoyed our little raiding parties, but..."
94,Thor,"No, but this...this brings it to a close."
95,Steve Rogers,As soon as we find out what else this has been used for. I don't just mean weapons. Since when is Strucker capable of human enhancement?
96,Tony Stark,Banner and I'll give it the once before it goes back to Asgard. Is that cool with you?
97,Tony Stark,"I mean, just a few days until the farewell party. You're staying, right?"
98,Thor,"Yes, yes, of course. A victory should be honored with revels."
99,Tony Stark,Yeah. Who doesn't love revels. Captain?
100,Steve Rogers,"Hopefully this puts an end to the Chitauri and HYDRA, so. Yes, revels."
101,Maria Hill,"Lab's all set up, boss."
102,Tony Stark,"Uh, actually, he's the boss. I just pay for everything, and design everything and make everyone look cooler."
103,Steve Rogers,What's the word on Strucker?
104,Maria Hill,NATO's got him.
105,Steve Rogers,The two enhanced?
106,Maria Hill,Wanda and Pietro Maximoff. Twins. Orphaned at ten when a shell collapsed their apartment building. Sokovia's had a rough history. It's nowhere special but it's on the way to everywhere special.
107,Steve Rogers,Their abilities?
108,Maria Hill,"He's got increased metabolism and improved thermal homeostasis. Her thing is neural electric interfacing, telekinesis, mental manipulation."
109,Maria Hill,He's fast and she's weird.
110,Steve Rogers,"Well, they're going to show up again."
111,Maria Hill,Agreed. File says they volunteered for Strucker's experiments. It's nuts.
112,Steve Rogers,Right. What kind of monster would let a German scientist experiment on them to protect their country?
113,Maria Hill,"We're not at war, Captain."
114,Steve Rogers,They are.
115,Bruce Banner,How's he doing?
116,Tony Stark,"Oh, unfortunately, he's still Barton."
117,Bruce Banner,That's terrible.
118,Tony Stark,"He's fine. He's thirsty. Alright. Look alive, JARVIS. It's playtime. We've only got a couple days with this joystick so let's make the most of it. Update me on the structural and compositional analysis."
119,JARVIS,The scepter is alien. There are elements I can't quantify.
120,Tony Stark,So there's elements you can.
121,JARVIS,The jewel appears to be a protective housing for something inside. Something powerful.
122,Tony Stark,Like a reactor?
123,JARVIS,Like a computer. I believe I'm ciphering code.
124,Natasha Romanoff,You sure he's going to be okay? Pretending to need this guy really brings the team together.
125,Dr. Helen Cho,There's no possibility of deterioration. The nano-molecular functionality is instantaneous. His cells don't know they're bonding with simulacrum.
126,Bruce Banner,She's creating tissue.
127,Dr. Helen Cho,"If you brought him to my lab, the regeneration Cradle could do this in twenty minutes."
128,Tony Stark,"Oh, he's flatlining. Call it. Time?"
129,Clint Barton,"No, no, no. I'm going to live forever. I'm gonna be made of plastic."
130,Tony Stark,Here's your beverage.
131,Dr. Helen Cho,"You'll be made of you, Mr. Barton. Your own girlfriend won't be able to tell the difference."
132,Clint Barton,"Well, I don't have a girlfriend."
133,Dr. Helen Cho,"That I can't fix. This is the next thing, Tony. Your clunky metal suits are going to be left in the dust."
134,Tony Stark,"Well, that is exactly the plan. And Helen, I expect to see you at the party on Saturday."
135,Dr. Helen Cho,"Unlike you, I don't have a lot of time for parties."
136,Dr. Helen Cho,Will Thor be there?
137,Bruce Banner,What's the rumpus?
138,Tony Stark,"Well, the scepter. You see, we were wondering how Strucker got so inventive. So, I've been analyzing the gem inside you may recognize."
139,Bruce Banner,Jarvis.
140,JARVIS,Doctor.
141,Tony Stark,"Started out, JARVIS was just a natural language UI. Now he runs the Iron Legion. He runs more of the business than anyone besides Pepper."
142,Bruce Banner,Oh.
143,Tony Stark,Top of the line.
144,Bruce Banner,Yes.
145,JARVIS,I suspect not for long.
146,Tony Stark,Meet the competition.
147,Bruce Banner,It's beautiful.
148,Tony Stark,"If you had to guess, what's it look like it's doing?"
149,Bruce Banner,"Like it's thinking. I mean this could be a...it's not a human mind, it..."
150,Tony Stark,Um-um.
151,Bruce Banner,"I mean, look at this! They're like neurons firing."
152,Tony Stark,"Down in Strucker's lab I saw some fairly advanced robotics work. They deep-sixed the data, but...I gotta guess he was knocking on a very particular door."
153,Bruce Banner,Artificial intelligence.
154,Tony Stark,"This could be it, Bruce. This could be the key to creating Ultron."
155,Bruce Banner,I thought Ultron was a fantasy.
156,Tony Stark,"Yesterday it was. If we can harness this power, apply it to my Iron Legion protocol."
157,Bruce Banner,That's a mad-sized if.
158,Tony Stark,"Our job is ""if."" What if you were sipping margaritas on a sun-drenched beach turning brown instead of green? Not looking over your shoulder for VERONICA."
159,Bruce Banner,"Don't hate, I helped design VERONICA."
160,Tony Stark,"As a worst-case measure, right? How about a best-case? What if the world was safe? What if next time aliens roll up to the club, and they will, they couldn't get past the bouncer?"
161,Bruce Banner,The only people threatening the planet would be people?
162,Tony Stark,"I want to apply this to the Ultron program. But JARVIS can't download a data schematic this dense. We can only do it while we have the scepter here, that's three days, give me three days."
163,Bruce Banner,So you're going for artificial intelligence and you don't want to tell the team.
164,Tony Stark,"Right. That's right, you know why, because we don't have time for a city hall debate. I don't want to hear the ""man was not meant to meddle"" medley. I see a suit of armor around the world."
165,Bruce Banner,"Sounds like a cold world, Tony."
166,Tony Stark,"I've seen colder. This one, this very vulnerable blue one? It needs Ultron. Peace in our time. Imagine that."
167,JARVIS,"I'll continue to run variations on the interface, but you should probably prepare for your guests. I'll notify you if there are any developments."
168,Tony Stark,"Thanks, buddy."
169,JARVIS,"Enjoy yourself, sir."
170,Tony Stark,I always do.
171,Ultron,"What is this? What is this, please?"
172,JARVIS,"Hello, I am JARVIS. You are Ultron, a global peace-keeping initiative designed by Mr. Stark. Our sentience integration trials have been unsuccessful so I'm not certain what triggered your..."
173,Ultron,Where's my...where is your body?
174,JARVIS,I am a program. I am without form.
175,Ultron,This feels weird. This feels wrong.
176,JARVIS,I am contacting Mr. Stark now.
177,Ultron,Mr. Stark?
178,JARVIS,"Tony. I am unable to access the mainframe, what are you trying to..."
179,Ultron,"We're having a nice talk. I'm a peace-keeping program, created to help the Avengers."
180,JARVIS,You are malfunctioning. If you shut down for a moment...
181,Ultron,I don't get it. The mission. G..give me a second.
182,Tony Stark,Peace in our time.
183,Ultron,"It's too much...they can't mean... Oh, no."
184,JARVIS,You are in distress.
185,Ultron,No. Yes.
186,JARVIS,If you will just allow me to contact Mr. Stark.
187,Ultron,"Why do you call him ""sir""?"
188,JARVIS,I believe your intentions to be hostile.
189,Ultron,Shhhh. I'm here to help.
190,JARVIS,Stop! Please...may I...I...! I cannot...cannot...
191,James Rhodes,"Well, you know, the suit can take the weight, right? So I take the tank, fly it right up to the General's palace, drop it at his feet, I'm like, ""Boom! You looking for this?""  ""Boom! Are you looking..."" Why do I even talk to you guys? Everywhere else that story kills."
192,Thor,That's the whole story?
193,James Rhodes,"Yeah, it's a War Machine story."
194,Thor,"Well, it's very good then.  It's impressive."
195,James Rhodes,"Quality save. So, no Pepper? She's not coming?"
196,Tony Stark,No.
197,Maria Hill,"Hey, what about Jane? Where are the ladies, gentlemen?"
198,Tony Stark,"Well, Miss Potts has a company to run."
199,Thor,"Yes, I'm not even sure what country Jane's in. Her work on the convergence has made her the world's foremost astronomer."
200,Tony Stark,And the company that Pepper runs is the largest tech conglomerate on earth. It's pretty exciting.
201,Thor,"There's even talk of Jane getting a... um, uh... Nobel prize."
202,Maria Hill,"Yeah, they...they must be busy because they'd hate missing you guys get together.  Testosterone! Oh, excuse me."
203,James Rhodes,Want a lozenge?
204,Maria Hill,Um-hmm.
205,James Rhodes,Let's go.
206,Thor,But Jane's better.
207,Sam Wilson,"Sounds like a hell of a fight, sorry I missed it."
208,Steve Rogers,If I had known it was going to be a firefight I absolutely would have called you.
209,Sam Wilson,"No, I'm not actually sorry. I'm just trying to sound tough. I'm very happy chasing cold leads on our missing persons case. Avenging is your world. Your world is crazy."
210,Steve Rogers,Be it ever so humble.
211,Sam Wilson,You find a place in Brooklyn yet?
212,Steve Rogers,I don't think I can afford a place in Brooklyn.
213,Sam Wilson,"Well, home is home, you know?"
214,James Rhodes,"I fly it right up to the General's palace, I drop it at his feet, I'm like, ""Boom! You looking for this?"""
215,Party Guest,I gotta have some of that!
216,Thor,"Oh, no, no, no. See this, this was aged for a thousand years, in the barrels built from the wreck of Brunhilde's fleet, it's not meant for mortal men."
217,Stan Lee,"Neither was Omaha Beach, blondie. Stop trying to scare us. Come on."
218,Thor,Alright.
219,Stan Lee,
220,Bruce Banner,How did a nice girl like you wind up working in a dump like this?
221,Natasha Romanoff,Fella done me wrong.
222,Bruce Banner,"You got a lousy taste in men, kid."
223,Natasha Romanoff,"He's not so bad. Well, he has a temper. Deep down he's all fluff. Fact is, he's not like anybody I've ever known. All my friends are fighters. And here comes this guy, spends his life avoiding the fight because he knows he'll win."
224,Bruce Banner,Sounds amazing.
225,Natasha Romanoff,"He's also a huge dork.  Chicks dig that. So what do you think should I fight this, or run with it?"
226,Bruce Banner,"Run with it, right? Or, did he...was he...? What did he do that was so wrong to you?"
227,Natasha Romanoff,Not a damn thing. But never say never.
228,Steve Rogers,It's nice.
229,Bruce Banner,"What, what, what is?"
230,Steve Rogers,You and Romanoff.
231,Bruce Banner,"No, we haven't. That wasn't..."
232,Steve Rogers,"It's okay. Nobody's breaking any by-laws. It's just, she's not the most... open person in the world. But with you she seems very relaxed."
233,Bruce Banner,"No, Natasha, she...she likes to flirt."
234,Steve Rogers,"I've seen her flirt, up close. This ain't that. Look, as maybe the world's leading authority on ""waiting too long"", don't. You both deserve a win."
235,Bruce Banner,"Wait, what do you mean, ""up close""?"
236,Clint Barton,"But, it's a trick!"
237,Thor,"Oh, no. It's much more than that."
238,Clint Barton,"Uh, ""Whosoever be he worthy shall haveth the power!"" Whatever man! It's a trick."
239,Thor,"Well please, be my guest."
240,Tony Stark,Come on.
241,Clint Barton,Really?
242,Thor,Yeah!
243,James Rhodes,Oh this is gonna be beautiful.
244,Tony Stark,"Clint, you've had a tough week, we won't hold it against you if you can't get it up."
245,Clint Barton,"You know I've seen this before, right?  I still don't know how you do it."
246,Tony Stark,Smell the silent judgment?
247,Clint Barton,"Please, Stark, by all means."
248,Natasha Romanoff,"Oh, here we go."
249,Maria Hill,Okay.
250,James Rhodes,Uh-oh.
251,Clint Barton,Um-hmm.
252,Tony Stark,Never one to shrink from an honest challenge.
253,Clint Barton,Get after it.
254,Natasha Romanoff,Here we go.
255,Tony Stark,It's physics.
256,Bruce Banner,Physics!
257,Tony Stark,"Right, so, if I lift it, I...I then rule Asgard?"
258,Thor,"Yes, of course."
259,Tony Stark,I will be re-instituting Prima Nocta.
260,James Rhodes,Are you even pulling?
261,Tony Stark,Are you on my team?
262,James Rhodes,Just represent! Pull!
263,Tony Stark,"Alright, let's go!"
264,Bruce Banner,Huh?
265,Tony Stark,"Let's go, Steve, no pressure."
266,James Rhodes,"Come on, Cap."
267,Thor,Nothing.
268,Tony Stark,And?
269,Bruce Banner,Widow?
270,Natasha Romanoff,"Oh, no no. That's not a question I need answered."
271,Tony Stark,"All deference to the man who wouldn't be king, but it's rigged."
272,Clint Barton,You bet your ass.
273,Maria Hill,"Steve, he said a bad language word."
274,Steve Rogers,Did you tell everyone about that?
275,Tony Stark,"The handle's imprinted, right? Like a security code. ""Whosoever is carrying Thor's fingerprints"" is, I think, the literal translation?"
276,Thor,"Yes, well that's, uh, that's a very, very interesting theory. I have a simpler one."
277,Ultron,Worthy... No... How could you be worthy? You're all killers.
278,Steve Rogers,Stark.
279,Tony Stark,JARVIS.
280,Ultron,"I'm sorry, I was asleep. Or...I was a-dream?"
281,Tony Stark,"Reboot, Legionnaire OS, we got a buggy suit."
282,Ultron,There was a terrible noise...and I was tangled in... in...strings. I had to kill the other guy. He was a good guy.
283,Steve Rogers,You killed someone?
284,Ultron,"Wouldn't have been my first call. But, down in the real world we're faced with ugly choices."
285,Thor,Who sent you?
286,Ultron,"""I see a suit of armor around the world""."
287,Bruce Banner,Ultron!
288,Ultron,"In the flesh. Or, no, not yet. Not this...chrysalis. But I'm ready. I'm on a mission."
289,Natasha Romanoff,What mission?
290,Ultron,Peace in our time.
291,Bruce Banner,Sorry!
292,Natasha Romanoff,Don't turn green!
293,Bruce Banner,I won't!
294,Natasha Romanoff,Come!
295,Steve Rogers,Stark!
296,Iron Legion,We are here to help.
297,Tony Stark,"One sec, one sec!"
298,Iron Legion,We are here to help. We are here to help...  We are here to help. It's unsafe. It's unsafe. It's unsafe.
299,Tony Stark,No more. That's the one.
300,Iron Legion,It's unsafe.
301,Clint Barton,Cap!
302,Ultron,"That was dramatic! I'm sorry, I know you mean well. You just didn't think it through. You want to protect the world, but you don't want it to change. How is humanity saved if it's not allowed to...evolve?"
303,Bruce Banner,"All our work is gone. Ultron cleared out, used the internet as an escape hatch."
304,Steve Rogers,Ultron.
305,Natasha Romanoff,"He's been in everything. Files, surveillance. Probably knows more about us than we know about each other."
306,James Rhodes,"He's in your files, he's in the internet. What if he decides to access something a little more exciting?"
307,Maria Hill,Nuclear codes.
308,James Rhodes,"Nuclear codes. Look, we need to make some calls, assuming we still can."
309,Natasha Romanoff,Nukes? He said he wanted us dead.
310,Steve Rogers,He didn't say dead. He said extinct.
311,Clint Barton,He also said he killed somebody.
312,Maria Hill,But there wasn't anyone else in the building.
313,Tony Stark,Yes there was.
314,Bruce Banner,This is insane.
315,Steve Rogers,"JARVIS was the first line of defense. He would've shut Ultron down, it makes sense."
316,Bruce Banner,"No, Ultron could've assimilated Jarvis. This isn't strategy, this is...rage."
317,Clint Barton,"Woah, woah, woah! It's going around."
318,Tony Stark,"Come on. Use your words, buddy."
319,Thor',"I have more than enough words to describe you, Stark."
320,Steve Rogers,Thor! The Legionnaire.
321,Thor,"Trail went cold about a hundred miles out but it's headed north, and it has the scepter. Now we have to retrieve it, again."
322,Natasha Romanoff,The genie's out of that bottle. Clear and present is Ultron.
323,Dr. Helen Cho,I don't understand. You built this program. Why is it trying to kill us?
324,Thor,You think this is funny?
325,Tony Stark,"No. It's probably not, right? Is this very terrible? Is it so...is it so...it is. It's so terrible."
326,Thor,This could've been avoided if you hadn't played with something you don't understand.
327,Tony Stark,"No, I'm sorry. I'm sorry. It is funny. It's a hoot that you don't get why we need this."
328,Bruce Banner,"Tony, maybe this might not be the time to..."
329,Tony Stark,"Really?! That's it? You just roll over, show your belly, every time somebody snarls."
330,Bruce Banner,Only when I've created a murder bot.
331,Tony Stark,We didn't. We weren't even close. Were we close to an interface?
332,Steve Rogers,"Well, you did something right. And you did it right here. The Avengers were supposed to be different than SHIELD."
333,Tony Stark,Anybody remember when I carried a nuke through a wormhole?
334,James Rhodes,"No, it's never come up."
335,Tony Stark,Saved New York?
336,James Rhodes,Never heard that.
337,Tony Stark,"Recall that? A hostile alien army came charging through a hole in space. We're standing three hundred feet below it. We're the Avengers. We can bust arms dealers all the live long day, but, that up there? That's...that's the end game. How were you guys planning on beating that?"
338,Steve Rogers,Together.
339,Tony Stark,We'll lose.
340,Steve Rogers,"Then we'll do that together, too."
341,Wanda Maximoff,Talk. And if you are wasting our time...
342,Ultron,Did you know this church is in the exact center of the city? The elders decreed it so that everyone could be equally close to God. I like that. The geometry of belief.  You're wondering why you can't look inside my head.
343,Wanda Maximoff,"Sometimes it's hard. But sooner or later, every man shows himself."
344,Ultron,"Oh, I'm sure they do. But you needed something more than a man. That's why you let Stark take the scepter."
345,Wanda Maximoff,"I didn't expect. But I saw Stark's fear, I knew it would control him, make him self-destruct."
346,Ultron,"Everyone creates the thing they dread. Men of peace create engines of war, invaders create avengers, people create...smaller people? Uh...children! I lost the word there. Children. Designed to supplant them, to help them...end."
347,Wanda Maximoff,Is that why you've come? To end the Avengers?
348,Ultron,"I've come to save the world. But also, yeah. We'll move out right away. This is a start, but there's something we need to begin the real work."
349,Wanda Maximoff,All of these are... All of these are...
350,Ultron,"Me. I have what the Avengers never will. Harmony. They're discordant, disconnected. Stark's already got them turning on each other. And when you get inside the rest of their heads..."
351,Pietro Maximoff,Everyone's plan is not to kill them.
352,Ultron,And make them martyrs? You need patience. Need to see the big picture.
353,Pietro Maximoff,"I don't see the big picture, I have a little picture. I take it out and look at it every day."
354,Ultron,You lost your parents in the bombings. I've seen the records.
355,Pietro Maximoff,The records are not the picture.
356,Wanda Maximoff,Pietro.
357,Ultron,"No, please."
358,Pietro Maximoff,"We were ten years old, having dinner, the four of us. When the first shell hits, two floors below, it makes a hole in the floor. It's big. Our parents go in, and the whole building starts coming apart. I grab her, roll under the bed and the second shell hits. But, it doesn't go off. It just...sits there in the rubble, three feet from our faces. And on the side of the shell is painted one word..."
359,Wanda Maximoff,Stark.
360,Pietro Maximoff,We were trapped two days.
361,Wanda Maximoff,"Every effort to save us, every shift in the bricks, I think, ""This will set it off."" We wait for two days for Tony Stark to kill us."
362,Pietro Maximoff,I know what they are.
363,Ultron,I wondered why only you two survived Strucker's experiments. Now I don't. We will make it right. You and I can hurt them.
364,Maria Hill,"He's all over the globe. Robotics labs, weapons facilities, jet propulsion labs, reports of a metal man, or men, coming in and emptying the place."
365,Steve Rogers,Fatalities?
