,Character,Dialog
734,Tony Stark,"You stood by my side all these years while I reaped the benefits of destruction. And now that I'm trying to protect the people that I put in harm's way, you're going to walk out?"
735,Pepper Potts,"You're going to kill yourself, Tony. I'm not going to be a part of it."
736,Tony Stark,"I shouldn't be alive, unless it was for a reason. I'm not crazy, Pepper. I just finally know what I have to do. And I know in my heart that it's right."
737,Pepper Potts,"You're all I have, too, you know. Sector 16? What are you up to, Obadiah?"
738,Video Voice Over,"You did not tell us that the target you paid us to kill was the great Tony Stark. As you can see, Obadiah Stane..."
739,Pepper Potts,"Oh, my God."
740,Video Voice Over,... your deception and lies will cost you dearly. The price to kill Tony Stark has just gone up.
741,Obadiah Stane,"So, what are we going to do about this? I know what you're going through, Pepper. Tony. He always gets the good stuff, doesn't he? I was so happy when he came home. It was like we got him back from the dead. Now I realize, well, Tony never really did come home, did he? He left a part of himself in that cave. Breaks my heart."
742,Pepper Potts,"Well, he's a complicated person."
743,Obadiah Stane,He's been through a lot. I think he'll be all right. You are a very rare woman. Tony doesn't know how lucky he is.
744,Pepper Potts,Thank you. Thanks. I'd better get back there.
745,Obadiah Stane,Is that today's paper?
746,Pepper Potts,Yes.
747,Obadiah Stane,Do you mind?
748,Pepper Potts,Not at all.
749,Obadiah Stane,Puzzle.
750,Agent Coulson,Ms. Potts? We had an appointment. Did you forget about our appointment?
751,Pepper Potts,"Nope, right now. Come with me."
752,Agent Coulson,Right now?
753,Pepper Potts,"We're going to have it right now. Yeah, walk with me."
754,Agent Coulson,Okay.
755,Pepper Potts,I'm going to give you the meeting of your life. Your office.
756,Obadiah Stane,Tony Stark was able to build this in a cave! With a box of scraps!
757,Pepper Potts,"Tony? Tony, are you there? Hello?"
758,Obadiah Stane,"Breathe. Easy, easy. You remember this one, right? It's a shame the government didn't approve it. There's so many applications for causing short-term paralysis. Tony. When I ordered the hit on you, I worried that I was killing the golden goose. But, you see, it was just fate that you survived that. You had one last golden egg to give. Do you really think that just because you have an idea, it belongs to you? Your father, he helped give us the atomic bomb. Now, what kind of world would it be today if he was as selfish as you? Oh, it's beautiful. Tony, this is your Ninth Symphony. What a masterpiece. Look at that. This is your legacy. A new generation of weapons with this at its heart. Weapons that will help steer the world back on course, put the balance of power in our hands. The right hands. I wish you could've seen my prototype. It's not as... Well, not as conservative as yours. Too bad you had to involve Pepper in this. I would have preferred that she lived."
759,James Rhodes,"What do you mean, he paid to have Tony killed? Pepper, slow down. Why would Obadiah... Okay, where's Tony now?"
760,Pepper Potts,"I don't know. He's not answering his phone. Please go over there and make sure everything's okay. Thank you, Rhodey. I know a shortcut."
761,Tony Stark,Good boy.
762,James Rhodes,Tony? Tony? Tony? Tony? Tony! Tony! You okay?
763,Tony Stark,Where's Pepper?
764,James Rhodes,She's fine. She's with five agents. They're about to arrest Obadiah.
765,Tony Stark,That's not going to be enough.
766,Pepper Potts,"Section 16. Section 16. There it is. My key's not working. It's not opening the door. Oh, wow! What's that? It's, like, a little device. It's, like, a thing that's going to pick the lock?"
767,Agent Coulson,You might want to take a few steps back.
768,James Rhodes,That's the coolest thing I've ever seen.
769,Tony Stark,"Not bad, huh? Let's do it."
770,James Rhodes,You need me to do anything else?
771,Tony Stark,Keep the skies clear.
772,James Rhodes,"Damn! Next time, baby."
773,Tony Stark,How do you think the Mark One chest piece is going to hold up?
774,JARVIS,"The suit's at 48% power and falling, sir. That chest piece was never designed for sustained flight."
775,Tony Stark,Keep me posted. Pepper!
776,Pepper Potts,"Tony! Tony, are you okay?"
777,Tony Stark,I'm fine. How are...
778,Pepper Potts,"Obadiah, he's gone insane!"
779,Tony Stark,"I know. Listen, you'd better get out of there."
780,Pepper Potts,He built a suit.
781,Tony Stark,Get out of there right now!
782,Obadiah Stane,"Collateral damage, Tony."
783,JARVIS,"Sir, it appears that his suit can fly."
784,Tony Stark,Duly noted. Take me to maximum altitude.
785,JARVIS,"With only 15% power, the odds of reaching that--"
786,Tony Stark,I know the math! Do it!
787,James Rhodes,"Not necessary, people. Just a training exercise."
788,JARVIS,"Thirteen percent power, sir."
789,Tony Stark,Climb!
790,JARVIS,Eleven percent.
791,Tony Stark,Keep going!
792,JARVIS,Seven percent power.
793,Tony Stark,Just leave it on the screen!
794,Obadiah Stane,"You had a great idea, Tony, but my suit is more advanced in every way!"
795,Tony Stark,How'd you solve the icing problem?
796,Obadiah Stane,Icing problem?
797,Tony Stark,Might want to look into it.
798,JARVIS,Two percent. We are now running on emergency backup power.
799,Tony Stark,Potts!
800,Pepper Potts,"Tony! Oh, my God, are you okay?"
801,Tony Stark,I'm almost out of power. I've got to get out of this thing. I'll be right there.
802,Tony Stark,Potts?
803,Pepper Potts,Tony!
804,Tony Stark,This isn't working. We're going to have to overload the reactor and blast the roof.
805,Pepper Potts,"Well, how are you going to do that?"
806,Tony Stark,"You're going to do it. Go to the central console, open up all the circuits. When I get clear of the roof, I'll let you know. You're going to hit the master bypass button. It's going to fry everything up here."
807,Pepper Potts,Okay. I'm going in now.
808,Tony Stark,Make sure you wait till I clear the roof. I'll buy you some time. This looks important!
809,Obadiah Stane,"I never had a taste for this sort of thing, but I must admit, I'm deeply enjoying the suit! You finally outdid yourself, Tony! You'd have made your father proud!"
810,Pepper Potts,"It's ready, Tony! Get off the roof! Tony!"
811,Obadiah Stane,"How ironic, Tony! Trying to rid the world of weapons, you gave it its best one ever!"
812,Tony Stark,Pepper!
813,Obadiah Stane,And now I'm going to kill you with it! You ripped out my targeting system!
814,Tony Stark,Time to hit the button!
815,Pepper Potts,You told me not to!
816,Obadiah Stane,"Hold still, you little prick!"
817,Tony Stark,Just do it!
818,Pepper Potts,You'll die!
819,Tony Stark,Push it!
820,Pepper Potts,Tony!
821,Tony Stark,"""Iron Man."" That's kind of catchy.It's got a nice ring to it. I mean, it's not technically accurate. The suit's a gold-titanium alloy, but it's kind of evocative, the imagery, anyway."
822,Agent Coulson,Here's your alibi.
823,Agent Coulson,You were on your yacht.
824,Agent Coulson,"We have port papers that put you in Avalon all night, and sworn statements from 50 of your guests."
825,Tony Stark,"See, I was thinking maybe we should say it was just Pepper and me alone on the island."
826,Agent Coulson,That's what happened.
827,Agent Coulson,"Just read it, word for word."
828,Tony Stark,There's nothing about Stane here.
829,Agent Coulson,That's being handled. He's on vacation. Small aircraft have such a poor safety record.
830,Tony Stark,"But what about the whole cover story that it's a bodyguard? He's my... I mean, is that... That's kind of flimsy, don't you think?"
831,Agent Coulson,"This isn't my first rodeo, Mr. Stark. Just stick to the official statement, and soon, this will all be behind you."
832,Pepper Potts,Agent Coulson? I just wanted to say thank you very much for all of your help.
833,Agent Coulson,That's what we do. You'll be hearing from us.
834,Pepper Potts,From the Strategic Homeland...
835,Agent Coulson,Just call us S.H.I.E.L.D.
836,Pepper Potts,Right. Let's get this show on the road.
837,Tony Stark,"You know, it's actually not that bad. Even I don't think I'm Iron Man."
838,Pepper Potts,You're not Iron Man.
839,Tony Stark,Am so.
840,Pepper Potts,You're not.
841,Tony Stark,"All right, suit yourself. You know, if I were Iron Man, I'd have this girlfriend who knew my true identity. She'd be a wreck, 'cause she'd always be worrying that I was going to die, yet so proud of the man I'd become. She'd be wildly conflicted, which would only make her more crazy about me. Tell me you never think about that night."
842,Pepper Potts,What night?
843,Tony Stark,You know.
844,Pepper Potts,"Are you talking about the night that we danced and went up on the roof, and then you went downstairs to get me a drink, and you left me there, by myself? Is that the night you're talking about? Thought so. Will that be all, Mr. Stark?"
845,Tony Stark,"Yes, that will be all, Miss Potts."
846,James Rhodes,"And now, Mr. Stark has prepared a statement. He will not be taking any questions."
847,Tony Stark,Thank you. Been a while since I was in front of you. I figure I'll stick to the cards this time. There's been speculation that I was involved in the events that occurred on the freeway and the rooftop...
848,Christine Everhart,"I'm sorry, Mr. Stark, but do you honestly expect us to believe that that was a bodyguard in a suit that conveniently appeared, despite the fact that you..."
849,Tony Stark,"I know that it's confusing. It is one thing to question the official story, and another thing entirely to make wild accusations, or insinuate that I'm a superhero."
850,Christine Everhart,I never said you were a superhero.
851,Tony Stark,"Didn't? Well, good, because that would be outlandish and fantastic. I'm just not the hero type. Clearly. With this laundry list of character defects, all the mistakes I've made, largely public."
852,James Rhodes,"Just stick to the cards, man."
853,Tony Stark,"Yeah, okay. Yeah. The truth is... I am Iron Man."
854,Tony Stark,Jarvis!
855,JARVIS,
856,Nick Fury,"""I am Iron Man."" You think you're the only superhero in the world? Mr. Stark, you've become part of a bigger universe. You just don't know it yet."
857,Tony Stark,Who the hell are you?
858,Nick Fury,"Nick Fury, Director of S.H.I.E.L.D."
859,Tony Stark,Ah.
860,Nick Fury,I'm here to talk to you about the Avengers Initiative.
0,Tony,Been a while since I was up here in front of you. Maybe Ill do us all a favour and just stick to the cards. Theres been some speculation that I was somehow involved in the events that occurred on the freeway and on the rooftopChristine Everhart
1,Man,"270 at 30 knots. Holding steady at 15000 feet. You are clear for exfiltration over the drop zonePretty much everyone in the crowd: Tony! Tony! Tony! Tony!Tony: Its good to be back. You missed me?Man in crowd: Blow something up!Tony: I missed you too. Blow something up? I already did that. Im not saying that the world is enjoying its longest period of uninterrupted peace in years because of me. Im not saying that from the ashes of captivity, never has a greater phoenix metaphor been personified in human history. Im not saying that Uncle Sam can kick back on a lawn chair, sipping on an iced tea because I havent come across anyone whos man enough to go toe-to-toe with me on my best day.Woman in crowd: I love you Tony!Tony: Please, its not about me.  and will one day rid society of all its ills. Soon technology will affect the way you live your life every day. No more tedious work, leaving more time for leisure activities and enjoying the sweet life. The Stark Expo. Welcome."
2,Reporter,"We are coming to you live from the kickoff at the Stark Expo, where Tony Stark has just walked offstage. Dont worry if you cant make it down here tonight because this Expo goes on all year long. And Im gonna be here checking out all the attractions and the pavilions and inventions from all around the world."
3,Happy Hogan,Make sure you join me
4,Tony,"All right, its a zoo out there, watch out."
5,Happy,"Open up, lets go."
6,Tony,"Hey, nice to see you. All right. Thank you. I remember you."
7,People,"Tony, Tony"
8,Tony,"Hey, hey."
9,Woman,Call me.
10,Happy,"Hey, hey, hey, hey. Come on, come on."
11,Tony,Hello. It would be a pleasure.
12,Happy,Okay
13,Tony,See you buddy
14,Happy,This is Larry.
15,Tony,"Hey, the oracle of Oracle. What a pleasure. Nice to see you."
16,Larry,Call me. Call me.
17,Happy,Larry King.
18,Tony,"Larry! Larry. Yes, my people, my people."
19,Happy,"Come on, Tony. There we go."
20,Tony,Very mellow.
21,Happy,That wasnt so bad.
22,Tony,"No, it was perfect."
23,Happy,"Look what we got here, the new model."
24,Tony,"Hey, does she come with the car?"
25,Happy,I certainly hope so. Hi.
26,Tony,Hi. And you are?
27,Woman,Marshal.
28,Tony,Irish. I like it.
29,Marshal,Pleased to meet you Tony.
30,Tony,Im on the wheel. Do you mind? Where you from?
31,Marshal,Bedford.
32,Tony,What are you doing here?
33,Marshal,Looking for you.
34,Tony,Yeah? You found me. What are you up to later?
35,Marshal,Serving subpoenas.
36,Tony,Yikes.
37,Happy,He doesnt like to be handed things.
38,Tony,"Yeah, I have a peeve."
39,Marshal,I got it. You are hereby ordered to appear before the Senate Armed Services Committee tomorrow morning at 9 am.
40,Tony,Can I see a badge?
41,Marshal,You wanna see the badge?
42,Happy,He likes the badge.
43,Marshal,You still like it?
44,Tony,Yep.  How far are we from D.C.?
45,Happy,D.C.? 250 miles.
46,Senator Stern,"Mr Stark, could we pick up now where we left off? Mr Stark. Please."
47,Tony,Yes dear?
48,Senator Stern,Can I have your attention?
49,Tony,Absolutely.
50,Stern,Do you or do you not possess a specialised weapon?
51,Tony,I do not.
52,Stern,You do not?
53,Tony,"I do not. Well, it depends on how you define the word weapon."
54,Stern,The Iron Man weapon.
55,Tony,My device does not fit that description.
56,Stern,Well How would you describe it?
57,Tony,"I would describe it by defining it as what it is, Senator."
58,Stern,As?
59,Tony,Its a high-tech prosthesis. That is That is Thats actually the most apt description I can make of it.
60,Stern,"Its a weapon. Its a weapon, Mr Stark."
61,Tony,"Please, if your priority was actually the well-being of the American citizen"
62,Stern,My priority is to get the Iron Man weapon turned over to the people of the United States of America.
63,Tony,"Well, you can forget it. I am Iron Man. The suit and I are one. To turn over the Iron Man suit would be to turn over myself which is tantamount to indentured servitude or prostitution, depending or what state youre in. You cant have it."
64,Stern,"Look, Im no expert"
65,Tony,In prostitution? Of course not. Youre a senator. Come on.
66,Stern,"Im no expert in weapons. We have somebody here who is an expert on weapons. Id now like to call Justin Hammer, our current primary weapons contractor."
67,Tony,"Let the record reflect that I observed Mr Hammer entering the chamber, and I am wondering if and when any actual expert will also be in attendance."
68,Justin Hammer,"Absolutely. Im no expert. I defer to you, Anthony. Youre the wonder boy. Senator, if I may. I may well not be an expert, but you know who was the expert? Your dad. Howard Stark. Really a father to us all, and to the military-industrial age. Lets just be clear, he was no flower child. He was a lion. We all know why were here. In the last six months, Anthony Stark has created a sword with untold possibilities. And yet, he insists its a shield. He asks us to trust him as we cower behind it. I wish I were comforted, Anthony, I really do. Id love to leave my door unlocked when I leave the house, but this aint Canada. You know, we live in a world of grave threats, threats that Mr Stark will not always be able to foresee. Thank you. God bless Iron Man. God bless America."
69,Stern,That is well said Mr Hammer. The committee would now like to invite Lieutenant Colonel James Rhodes to the chamber.
70,Tony,Rhodey? What?
71,Tony,"Hey, buddy. I didnt expect to see you here."
72,Rhodey,"Look, its me, Im here. Deal with it. Lets move on."
73,Tony,I just
74,Rhodey,Drop it.
75,Tony,"All right, Ill drop it."
76,Stern,"I have before me a complete report on the Iron Man weapon, complied by Colonel Rhodes. And, Colonel, for the record, can you please read page 57, paragraph four?"
77,Rhodey,"Youre requesting that I read specific selections from my report, Senator?"
78,Stern,"Yes, sir."
79,Rhodey,It was my understanding that I was going to be testifying in a much more comprehensive and detailed manner.
80,Stern,I understand. A lot of things have changed today. So if you could just read
81,Rhodey,You do understand that reading a single paragraph out of context does not reflect the summery of my final
82,Stern,"Just read it, Colonel. I do. Thank you."
83,Rhodey,"Very well. As he does not operate within any definable branch of government, Iron Man presents a potential threat to the security of both the nation and to her interests. I did however, go on to summarise that the benefits of Iron Man far outweigh three liabilities and that it would be in our interest"
84,Stern,Thats enough Colonel
85,Rhodey,to fold Mr Stark
86,Stern,Thats enough
87,Rhodey,"into the existing chain of command, Senator."
88,Tony,"Im not a joiner, but Ill consider Secretary of Defence, if you ask nice."
89,Tony,We can amend the hours a little bit.
90,Stern,"Id like to go on and show, if I may, the imagery thats connected to your report."
91,Rhodey,I believe it is somewhat premature to reveal these images to the general public at this time.
92,Stern,"With all due respect, Colonel, I understand. And if you could just narrate those for us, wed be very grateful. Lets have the images."
93,Rhodey,"Intelligence suggests that the devices seen in these photos are, in fact, attempts at making manned copies of Mr Starks suit. This has been corroborated by our allies and local intelligence on the ground"
94,Rhodey," indicating that these suits are quite possibly, at this moment, operational."
95,Tony,"Hold on a second buddy. Let me see something here.  Boy, Im good. I commandeered your screens. I need them. Time for a little transparency. Now, lets see whats really going on."
96,Stern,What is he doing?
97,Tony,"If you will direct your attention to said screens, I believe thats North Korea."
98,Stern,Can you turn that off? Take it off.
99,Tony,Iran.
100,Tony,No grave threat here. Is that Justin Hammer? How did Hammer get in the game?
101,Tony,"Justin, youre on TV. Focus up."
102,TV Justin,"Okay, give me a left twist. Lefts good. Turn to the right. Oh, shit. Oh, shit."
103,Tony,"Wow. Yeah, Id say most countries, five, ten years away. Hammer Industries, twenty."
104,Justin,Id like to point out that that test pilot survived.
105,Stern,I think were done is the point that hes making. I dont think theres any reason
106,Tony,"The point is, youre welcome, I guess"
107,Stern,For what?
108,Tony,Because Im your nuclear deterrent. Its working. Were safe. America is secure. You want my property? You cant have it. But I did you a big favour.
109,Tony,Ive successfully privatised world peace.
110,Tony,What more do you want? For now! I tried to play ball with these ass-clowns.
111,Stern,"you, buddy. Were adjourned. Were adjourned for today."
112,Tony,Okay.
113,Stern,Youve been a delight.
114,Tony,My bond is with the people. And I will serve this great nation at the pleasure of myself. If theres one thing Ive proven its that you can count on me to pleasure myself.
115,Tony,"Wake up, Daddys home."
116,Jarvis,"Welcome home, sir. Congratulations on the opening ceremonies. They were such a success, as was your Senate hearing. And may I say how refreshing it is to finally see you in a video with your clothing on, sir."
117,Tony,You!
118,Tony,I swear to God Ill dismantle you. Ill soak your motherboard. Ill turn you into a wine rack.
119,Tony,How many ounce a day of this gobbledegook am I supposed to drink?
120,Jarvis,"We are up to 80 ounces a day to counteract the symptoms, sir."
121,Tony,Check palladium levels.
122,Jarvis,"Blood toxicity, 24%. It appears that the continued use of the Iron Man suit is accelerating your condition. Another core has been depleted."
123,Tony,"God, theyre running out quick."
124,Jarvis,"I have run simulations on every known element, and none can serve as a viable replacement for the palladium core."
125,Jarvis,"You are running out of both time and options. Unfortunately, the device thats keeping you alive is also killing you."
126,Jarvis,Miss Potts is approaching. I recommend that you inform her
127,Tony,Mute.
128,Pepper,Is this a joke? What are you thinking?
129,Tony,What?
130,Pepper,What are you thinking?
131,Tony,"Hey, Im thinking Im busy. And youre angry about something. Do you have the sniffles? I dont want to get sick."
132,Pepper,Did you just donate
133,Tony,Keep your business.
134,Pepper,our entire modern art collection to the
135,Tony,Boy Scouts of America.
136,Pepper,Boy Scouts of America?
137,Tony,"Yes. It is a worthwhile organisation. I didnt physically check the crates but, basically, yes. And its not our collection, its my collection. No offence."
138,Pepper,"No, you know what? I think Im actually entitled to say our collection considering the time that I put in, over 10 years, curating that."
139,Tony,It was a tax write-off. I needed that.
140,Pepper,"You know, theres only about 8,011 things that I really need to talk to you about."
141,Tony,"Dummy. Hey, stop spacing out. The Bridgeports already machining that part."
142,Pepper,The Expo is a gigantic waste of time.
143,Tony,I need you to wear a surgical mask until youre feeling better. Is that okay?
144,Pepper,Thats rude.
145,Tony,Theres nothing more important to me than the Expo. Its my primary point of concern. I dont know why youre
146,Pepper,The Expo is your ego gone crazy.
147,Tony,Wow. Look at that. Thats modern art. Thats going up.
148,Pepper,Youve got to be kidding.
149,Tony,Im gonna put this up right now. This is vital.
150,Pepper,Stark is in complete disarray. You understand that?
151,Tony,No. Our stocks have never been higher.
152,Pepper,"Yes, from a managerial standpoint."
153,Tony,"You are Well, ifs messy then lets double back."
154,Pepper,Let me give you an example.
155,Tony,Lets move onto another subject.
156,Pepper,"No, no, no, no. You are not taking down the Barnett Newman and hanging that up."
157,Tony,Im not taking it down. Im just replacing it with this.
158,Tony,Lets see what I can get going on here.
159,Pepper,"Okay, fine. My point is, we have already awarded contracts to the wind farm people."
160,Tony,Yeah. Dont say wind farm. Im already feeling gassy.
161,Pepper,"And to the plastic plantation tree, which was your idea by the way. Those people are on payroll"
162,Tony,Everything was my idea.
163,Pepper,and you wont make a decision.
164,Tony,I dont care about the liberal agenda any more. Its boring. Boring. Im giving you a boring alert.  You do it.
165,Pepper,I do what?
166,Tony,Excellent idea. I just figured this out. You run the company.
167,Pepper,"Yeah, Im trying to run the company."
168,Tony,"Pepper, I need you to run the company. Well, stop trying to do it and do it."
169,Pepper,You will not give me the information
170,Tony,Im not asking you to try
171,Pepper,in order to
172,Tony,Im asking you to physically do it. I need you to do it.
173,Pepper,I am trying to do it.
174,Tony,"Pepper, youre not listening to me!"
175,Pepper,"No, you are not listening to me."
176,Tony,Im trying to make you CEO. Why wont you let me?
177,Pepper,Have you been drinking?
178,Tony,"Chlorophyll. I hereby irrevocably appoint you chairman and CEO of Stark Industries effective immediately. Yeah, done deal. Okay? Ive actually given this a fair amount of thought, believe it or not.  Congratulations? Take it, just take it."
179,Pepper,I dont know what to think.
180,Tony,"Dont think, drink. There you go."
181,Pepper,The notarys here! Can you please come sign the transfer paperwork?
182,Tony,Im on happy time.  Sorry.
183,Happy,What the hell was that?
184,Tony,Its called mixed martial arts. Its been around for three weeks.
185,Happy,"Its called dirty boxing, theres nothing new about it"
186,Tony,"All right, put them up. Come on."
187,Pepper,I promise this is the only time I will ask you to sign over your company.
188,Notary,I need you to initial each box.
189,Happy,
190,Tony,"Thats it. Im done. Whats your name, lady?"
191,Notary,Rushman. Natalie Rushman
192,Tony,Front and centre. Come into the church.
193,Pepper,No. Youre seriously not gonna ask
194,Tony,"If it pleases the court, which it does."
195,Natalie,Its no problem.
196,Pepper,Im sorry. Hes very eccentric.
197,Tony,Can you give her a lesson?
198,Happy,No problem.
199,Tony,Pepper.
200,Pepper,What?
201,Tony,Who is she?
202,Pepper,She is from legal. And she is potentially a very expensive sexual harassment lawsuit if you keep ogling her like that.
203,Tony,"I need a new assistant, boss."
204,Pepper,"Yes, and Ive got three excellent potential candidates. Theyre lined up and ready to meet you."
205,Tony,I dont have time to meet. I need someone now. I feel like its her.
206,Pepper,"No, its not."
207,Happy,You ever boxed before?
208,Natalie,"I have, yes."
209,Happy,"What, like, the Tae Bo? Booty Boot Camp? Crunch? Something like that?"
210,Tony,"How do I spell your name, Natalie?"
211,Natalie,R-U-S-H-M-A-N.
212,Pepper,"What, are you gonna google her now?"
213,Tony,"I thought I was ogling her.  Wow. Very, very impressive individual."
214,Pepper,"Youre so predictable, you know that?"
215,Tony,"Shes fluent in French, Italian, Russian, Latin. Who speaks Latin?"
216,Pepper,No one speaks Latin.
217,Tony,No one speaks Latin
218,Pepper,"Its a dead language. You can read Latin or you can write Latin, but you cant speak Latin."
