,Character,Dialog
417,Justin,"Hey. There he is. There he is. What an absolute pleasure. Welcome. Oh goodness gracious. Can we get the handcuffs off my friend here? Forgive me, I’m sorry. I’m such a huge fan of yours. I didn’t want to make a first impression like this. He’s not an animal. Come on. He’s a human being. Thank you. We’re fine. My name is Justin Hammer. I’d like to do some business with you. Please sit. Dig in. What do we have today Jack?"
418,Jack,We have some salmon carpaccio.
419,Justin,"Salmon carpaccio. Anything you want here, we got it. I like my dessert first. I had this flown in from San Francisco. It’s Italian though. Organic ice cream. I got a sweet tooth. Apparently you do too, for Tony Stark. What I saw you do to Tony Stark on that track, how you stepped up to him in front of God and everybody that was… Wow. You spoke to me with what you did. And I know that you knew that I’d be listening. This is why I couldn’t bear to have you shipped off to God knows where. It would have been such a waste of talent. But if I might make a suggestion, you know, you don’t just go and try to kill the guy. I think, if I may, you go after his legacy. That’s what you kill. You and me, we are a lot alike in a lot of ways. The only difference between you and I is that I have resources. I think, if I may, you need my resources. Someone behind you, a benefactor. I’d like to be that guy."
420,Ivan,
421,Justin,Okay. Do you speak English? Because I can get a translator. I don’t know. Have you been understanding everything I’m saying?
422,Ivan,"Very good, man."
423,Justin,"Very good, man."
424,Ivan,"Very good, man."
425,Justin,Hey!
426,Ivan,Hey.
427,Justin,Yes?
428,Ivan,I want my bird.
429,Justin,A bird? You want a bird?
430,Ivan,I want my bird.
431,Justin,I can get you a bird. I can get you ten birds.
432,Ivan,I want my bird.
433,Justin,"Well, okay. Nothing’s impossible. I could… Are we talking about… Is this a bird back in Russia?"
434,Pepper,"Yes, but the fundamentals of the company are still very, very strong despite the events in Monaco."
435,Natalie,The AP wants a quote.
436,Pepper,Don’t tell them. Fax them…
437,Rhodey,Where is he?
438,Natalie,He doesn’t want to be disturbed.
439,Pepper,He’s downstairs.
440,News reader,But what happened in Monaco?
441,Pepper,"Yes, but…."
442,News reader,"But his continuing erratic behaviour may lead many people to ask themselves, “Can this man still protect us?”"
443,Pepper,Iron Man never stopped protecting us. The events in Monaco proved that.
444,JARVIS,"Query complete sir. Anton Vanko was a Soviet physicist who defected to the United States in 1963.However, he was accused of espionage and was deported in 1967. His son, Ivan, who is also a physicist, was convicted of selling Soviet-era weapons grade plutonium to Pakistan, and served 15 years in Kopeisk prison. No further records exist."
445,Rhodey,"Tony, you gotta get upstairs and get on top of this situation right now. Listen. I’ve been on the phone with the National Guard all day, trying to talk them out of rolling tanks up the PCH, knocking down your front door and taking these. They’re gonna take your suits, Tony, okay? They’re sick of the games. You said nobody else would possess this technology for 20 years. Well, guess what? Somebody else had it yesterday. It’s not theoretical anymore. Are you listening to me? Are you okay?"
446,Tony,Let’s go.
447,Rhodey,"Hey, man. Hey, hey! You all right?"
448,Tony,"Yeah, I should get to my desk.  See that cigar box?"
449,Rhodey,Yeah.
450,Tony,It’s palladium.
451,Rhodey,Is that supposed to be smoking?
452,Tony,"If you must know, it’s neutron damage. It’s from the reactor wall."
453,Rhodey,You had this in your body? And how about the high-tech crossword puzzle on your neck?
454,Tony,Road rash. Thank you.  What are you looking at?
455,Rhodey,I’m looking at you. You wanna do this whole lone gunslinger act and it’s unnecessary. You don’t have to do this alone.
456,Tony,"You know, I wish I could believe that. I really do. But you’ve gotta trust me. Contrary to popular belief, I know exactly what I’m doing."
457,Justin,"This is where we do it. This is my humble abode. You can work in absolute peace. Must be fun to be dead, right? No pressure. Here they are. I’m very excited. They’re combat-ready. I may have done a few miscalculations and rushed the prototype into production. Sue me, I’m enthusiastic. Go ahead, take a look around.  You don’t wanna do that. You’ll be able to access that as soon as we generate some encrypted pass codes. Can we generate some encrypted pass codes? Get some of those encrypted pass codes, Jack. Never mind, I… Wow. Okay. Good stuff."
458,Ivan,unintelligible
459,Justin,Sorry?
460,Ivan,Software shit.
461,Justin,"Well… You’re good. You really blasted in past the firewall there. Let me show you where you’re gonna be working primarily. Go ahead, take a look. Get a good look at that. That’s something, isn’t it? You know, those are really just for show and tell. They’re $125.7 million a pop, so… Wait!  Oh gosh. Jesus Christ. Get somebody up here. That’s where the pilot goes. I’m having a tough time finding volunteers. I’ll take care of that, just leave it."
462,Ivan,What you want them do?
463,Justin,"Well, long term, I want them to put me in the Pentagon for the next 25 years. I want to make Iron Man look like an antique. I wanna go to that Stark Expo, I wanna take a dump in Tony Stark’s front yard. You know what I’m talking about?"
464,Ivan,I can do that. No problem.
465,Justin,"Yeah? Hey, fabulous! I love it. Hey, this is our guy. Didn’t I tell you? I had a feeling."
466,Natalie,"Do you know which watch you’d like to wear tonight, Mr Stark?"
467,Tony,I’ll give them a look. I should cancel the party.
468,Natalie,Probably.
469,Tony,Yeah. ‘Cause it’s…
470,Natalie,Ill-timed.
471,Tony,"Right, sends the wrong message."
472,Natalie,Inappropriate.  Is that dirty enough for you?
473,Tony,"Gold face, brown hand. The Jaeger. I’ll give that a look. Bring them over.  I gotta say it. It’s hard to get a read on you. Where are you from?"
474,Natalie,Legal.
475,Tony,"Can I ask you a question, hypothetically? Bit odd. If this was your last birthday party you were ever gonna have, how would you celebrate it?"
476,Natalie,I’d do whatever I wanted to do with whoever I wanted to do it with.
477,Person,Good evening
478,Person,Good evening
479,Rhodey,"Yes, sir, I understand. No. No, sir, that will not be necessary. I’ll handle it. Sir, I personally guarantee that within 24 hours, Iron Man will be back on watch.  Hey Pepper."
480,Pepper,I’m going to get some air.
481,Rhodey,What’s wrong?
482,Pepper,I don’t know what to do.
483,Rhodey,"You gotta be kidding me.  That’s it, I’m making…."
484,Pepper,"No, no, no. Don’t call anyone."
485,Rhodey,Pepper. This is ridiculous. I just stuck my neck out for this guy.
486,Pepper,"I know. I know. I get it. I’m gonna handle it, okay Just let me handle it."
487,Rhodey,Handle it. Or I’m gonna have to.
488,Tony,
489,Pepper,Does this guy know how to throw a party or what?
490,Tony,I love you.
491,Pepper,"Unbelievable! Thank you so much. Tony, we all thank you so much for such a wonderful night. And we’re gonna say good night now, and thank you all for coming."
492,Tony,"No, no, no, we can’t … Wait, wait, wait. We didn’t have the cake. We didn’t blow out the candles."
493,Pepper,"You’re out of control, okay? Trust me on this, okay?"
494,Tony,You’re out of control gorgeous.
495,Pepper,It’s time to go to bed. It’s time.
496,Tony,Give me another smooch
497,Pepper,You’re not going to be happy about this.
498,Tony,"Come on, you know you want to."
499,Pepper,You just peed in the suit.
500,Tony,I know. It has a filtration system.
501,Pepper,It’s not sexy.
502,Tony,You could drink that water.
503,Pepper,"Just send everybody home, okay? It’s time to…"
504,Tony,If you say so.
505,Pepper,"Okay. I’ll take this, you take that"
506,Tony,"Pepper Potts. She’s right. The party’s over. Then again, the party was over for me, like, an hour and a half ago. The after-party starts in 15 minutes. And if anybody, Pepper, doesn’t like it, there’s the door.  I think she wants the Gallagher!"
507,Rhodey,You don’t deserve to wear one of these. Shut it down!
508,Tony,Goldstein.
509,Goldstein,"Yes, Mr Stark?"
510,Tony,Give me a phat beat to beat my buddy’s ass to.
511,Rhodey,
512,Tony,"Now, put that thing back where you found it before someone gets hurt.  Sorry, pal, but Iron Man doesn’t have a sidekick."
513,Rhodey,Had enough?
514,Pepper,Natalie!
515,Natalie,Miss Potts.
516,Pepper,Don’t you “Miss Potts” me! I’m on to you. You know what? Ever since you came here…
517,Happy,Pepper!
518,Tony,You want it? Take it!
519,Rhodey,Put you hand down.
520,Tony,You think you got what it takes to wear that suit?
521,Rhodey,"We don’t have to do this, Tony."
522,Tony,"You wanna be the War Machine, take your shot."
523,Rhodey,Put it down!
524,Tony,You gonna take a shot?
525,Rhodey,Put it down!
526,Tony,No!
527,Rhodey,Drop it Tony!
528,Tony,Take it!
529,Rhodey,"Edwards Tower, this is Lieutenant Colonel James Rhodes, inbound from three miles east at 5,000 feet…"
530,Major Allen,Colonel.
531,Rhodey,Major.
532,Major Allen,Wow.
533,Rhodey,Yeah. Let’s take it inside.
534,Major Allen,Clear the area.
535,Nick Fury,Sir! I’m gonna have to ask you to exit the doughnut.
536,Tony,I told you I don’t wanna join your super-secret boy band.
537,Fury,"No, no, no. See, I remember, you do everything yourself. How’s that working out for you?"
538,Tony,It’s… It’s… It’s… I’m sorry. I don’t wanna get off on the wrong foot. Do I look at the patch or the eye? Honestly I’m a bit hung over. I’m not sure if you’re real of if I’m having…
539,Fury,I am very real. I’m the realest person you’re ever gonna meet.
540,Tony,Just my luck. Where’s the staff here?
541,Fury,That’s not looking so good.
542,Tony,I’ve been worse.
543,SHIELD agent,We’ve secured the perimeter but I don’t think we should hold it for too much longer.
544,Tony,You’re fired.
545,Natalie,That’s not up to you.
546,Fury,"Tony, I want you to meet Agent Romanoff."
547,Tony,Hi.
548,Natalie/Agent Romanoff,"I’m a SHIELD shadow. Once we knew you were ill, I was tasked to you by Director Fury."
549,Tony,I suggest you apologise.
550,Fury,"You’ve been very busy. You made your girl your CEO, you’re giving away all your stuff. You let your friend fly away with your suit. Now, if I didn’t know better…"
551,Tony,You don’t know better. I didn’t give it to him. He took it.
552,Fury,"Whoa, whoa, whoa. He took it? You’re Iron Man and he just took it? The little brother walked in there, kicked your ass and took your suit?  Is that possible?"
553,Agent Romanoff,"Well, according to Mr Stark’s database security guidelines, there are redundancies to prevent unauthorised usage."
554,Tony,What do you want from me?
555,Fury,What do we want from you? What do you want from me?  Hit him.
556,Tony,"Oh, God, are gonna steal my kidney and sell it?  Could you please not do anything awful for five seconds? What did she just do to me?"
557,Fury,What did we just do for you? That’s lithium dioxide. It’s gonna take the edge off. We’re trying to get you back to work.
558,Tony,Give me a couple of boxes of that. I’ll be right as rain.
559,Agent Romanoff,"It’s not a cure, it just abates the symptoms."
560,Fury,Doesn’t look like it’s gonna be an easy fix.
561,Tony,"Trust me, I know. I’m good at this stuff. I’ve been looking for a suitable replacement for palladium. I’ve tried every combination, every permutation of every known element."
562,Fury,"Well, I’m here to tell you, you haven’t tried them all."
563,Justin,"Hey, hey, het. Special delivery. Candygram.  We got you the bird, pal."
564,Ivan,This is not my bird.
565,Justin,"What do you mean? That’s the bird. This is the bird. Yeah, pulled a lot of strings to get this bird. This is a great bird."
566,Jack,It’s a beautiful bird.
567,Justin,We got this bird all the way from Russia.
568,Ivan,"Hey, man, this is not my bird."
569,Justin,"Well, listen, even if it’s not the bird, I mean, this is a gorgeous bird. I mean, you know, look, don’t get so attached to things. Learn to let go. Wait a minute. Jack, what is that? Is that… That’s not a helmet. What is that?  Ivan… What’s this? Jack. Is that a helmet? It doesn’t look like a helmet to me. How… How are you supposed to get a head in there? Jack, could you put your head in there?"
570,Jack,No.
571,Justin,"Try to put your head in there. Go ahead. Try to put your head in there.  See, Ivan? He can’t put his head in there. That’s… That’s not a helmet. It’s a head. I need to put a guy in there. I need to fit a person in that suit. You understand?"
572,Ivan,Drone better.
573,Justin,What? Drone better? Why is drone better? Why is drone better?
574,Ivan,People make problem. Trust me. Drone better.
575,Justin,"Ivan, you know, I like you. I got you the bird. You said, “No problem.” That’s what you said to me. You said, “No problem.” Now I need suits. The government wants suits. Like Iron Man. You understand? That’s what the people want. That’s what’s gonna make them happy."
576,Ivan,"Hey, man. Don’t get too attached to things. Learn to let go."
577,Justin,"These drones better steal the show, Ivan. You understand? Better rock my world, Ivan."
578,General,Unbelievable. This ought to get the Senate off my ass. It’s functional?
579,Rhodey,Fully mission-capable.
580,General,Good. Get Hammer down here to weaponise it.
581,Rhodey,Sir?
582,General,Justin Hammer’s making a weapons presentation at the Expo. We’d like this to introduce it.
583,Rhodey,"Sir, I don’t believe that the Expo…"
584,General,"Colonel, the world needs to see this fast. We’ve got to make this happen."
585,Rhodey,"Yes, General, but…"
586,General,It’s also an order.
587,Rhodey,Yes sir.
588,General,"Good work, Colonel. You’ve made your country proud."
589,Rhodey,Thank you sir.
590,Fury,That thing in your chest is based on unfinished technology.
591,Tony,"No, it was finished. It has never been particularly effective until I miniaturised it and put it in my…"
592,Fury,"No. Howard said the arc reactor was the stepping stone to something greater. He was about to kick off an energy race that was gonna dwarf the arms race. He was on to something big, something so big that it was gonna make the nuclear reactor look like a triple-A battery."
593,Tony,"Just him, or Anton Vanko in on this too?"
594,Fury,"Anton Vanko is the other side of that coin. Anton saw it as a way to get rich. When your father found out, he had him deported. When the Russians found out he couldn’t deliver they shipped his ass off to Siberia and he spent the next 20 years in a vodka-fuelled rage. Not quite the environment you want to raise a kid in, the son you had the misfortune of crossing paths with in Monaco."
595,Tony,You told me I hadn’t tried everything. What do you mean I haven’t tried everything? What haven’t I tried?
596,Fury,He said that you were the only person with the means and knowledge to finish what he started.
597,Tony,He said that?
598,Fury,"Are you that guy? Are you? ‘Cause if you are, then you can solve the riddle of your heart."
599,Tony,"I don’t know where you get your information, but he wasn’t my biggest fan."
600,Fury,What do you remember about your dad?
601,Tony,"He was cold, he was calculating. He never told me he loved me. He never even told me he liked me, so it’s a little tough for me to digest when you’re telling me he said the whole future was riding on me and he’s passing it down. I don’t get that. You’re talking about a guy who’s happiest day was when he shipped me off to boarding school."
602,Fury,That’s not true.
603,Tony,"Well, then, clearly you knew my dad better than I did."
604,Fury,"As a matter of fact, I did. He was one of the founding members of SHIELD."
605,Tony,What?
606,Fury,I got a two o’clock
607,Tony,"Wait, wait, wait, wait. What’s this?"
608,Fury,"Okay, you’re good, right?"
609,Tony,"No, I’m not good."
610,Fury,You got this? Right? Right?
611,Tony,Got what? I don’t even know what I’m supposed to get.
612,Fury,"Natasha will remain a floater at Stark with her cover intact. You remember Agent Coulson, right?"
613,Tony,Yeah.
614,Fury,"And Tony, remember, I got my eye on you."
615,Natalie/Agent Romanoff/Natasha,We’ve disabled all communications. No contact with the outside world. Good luck.
616,Tony,"Please. First thing, I need a little bodywork. I’ll put in a little time at the lab. If we could send one of your goon squad down to The Coffee Bean, Cross Creek, for a Starbucks run, or something like that, that’d be nice."
617,Agent Coulson,"I’m not here for that. I’ve been authorised by Director Fury to use any means necessary to keep you on premises. If you attempt to leave or play any games, I will tase you and watch Supernanny while you drool into the carpet. Okay?"
618,Tony,"I think I got it, yeah."
619,Agent Coulson,Enjoy your evening’s entertainment.
620,Major Allen,Think this is the power source?
621,Rhodey,"Major, this is not a scientific exercise. Let’s just focus on arming it, all right?"
622,Major Allen,"Yes, sir."
623,Justin,"Oh, yes! Oh, yes, yes, yes. Is it my birthday? You got it. What did you do? What did you do? Is this what I think it is?"
624,Rhodey,"Yes it is. Hammer, I want to know what you’re gonna do for us."
625,Justin,"What am I going to do for you? Well, the first thing I’m gonna do for you is I’m gonna upgrade your software. And then, second, I think I should…"
626,Rhodey,That’s not what I’m talking about. I’m talking about firepower.
627,Justin,"Well, you’re talking to the right guy.  Claridge Hi-Tec, semi-automatic, 9mm pistol. Too downtown? I agree. M24 shotgun, pump action. Five-round magazine. You know what? You’re not a hunter. What am I talking about? I’m getting rid of it. This is the FN-2000 from Belgium. They do make something better than waffles. It’s beautiful, But I can tell this isn’t disco enough for you, so I’m gonna put it right here. You’re looking at a Milkor 40mm grenade launcher. Tear gas, smoke. Hippie control. You’re tough. Let me tell you something. Size does matter. Don’t let anyone tell you different. This is an M134 7.62 Minigun. Six invidual barrels. The torso taker, powder maker. Our boys in uniform call in Uncle Gazpacho or Puff the Magic Dragon. Okay. These are the Cubans, baby. This is the Cohibas, the Montecristos. This is a kinetic-kill, side-winder vehicle with a secondary cyclotrimethlyenetrinitamine RDX burst. It’s capable of busting the bunker under the bunker you just busted. If it were any smarter, it would write a book. A book that would make Ulysses look like it was written in crayon. It would read it to you. This is my Eiffel Tower. This is my Rachmaninoff’s Third. My Pieta. It’s completely elegant. It’s bafflingly beautiful. And it’s capable of reducing the population of any standing structure to zero. I call it the Ex-Wife. That’s the best I got. Are we gonna do this? Give me something here. You’re like a sphinx. I can’t read you."
628,Rhodey,I think I’ll take it.
629,Justin,Which one?
630,Rhodey,All of it.
631,Justin,All of it.
632,Howard,"Everything is achievable through technology. Better living, robust heath,"
633,Man,"All right, I think we got…"
634,Howard,I’ll… I’ll… I’ll come in and…
635,Man,Are you waiting on me?
636,Howard,"So, from all of us at Stark Industries, I’d like to personally show you my ass. I’d like to… I can’t… This is… I can’t… We have this, don’t we? This is a ridiculous way… Everything  Tony. You’re too young to understand this right now, so I thought I would put it on film for you. I built this for you. And someday you’ll realise that it represents a whole lot more than just people’s inventions. It represents my life’s work. This is the key to the future. I’m limited by the technology of my time, but one day you’ll figure this out. And when you do, you will change the world. What is and always will be my greatest creation is you. [Tony looks like he’s about to cry as the film ends."
637,Tony,How much?
638,Strawberry man,$6. Six.
639,Tony,I don’t have any dough. Here.
640,Strawberry man,"No, sir, that’s too much."
641,Tony,"No, it’s fine. Take that. It’s fine"
642,Strawberry man,"No, señor."
643,Tony,"Take it. Take it. I don’t like people handing me things. If you just drop that there, that’d be great."
644,Strawberry man,Are you Iron Man?
645,Tony,Sometimes.
646,Strawberry man,We believe in you!
647,Pepper,It was an illegal seizure of trademark property.
648,PA,Miss Potts?
649,Tony,Relax.
650,PA,Mr Stark…
651,Tony,Is here.
652,PA,He refuses…
653,Tony,I don’t. It’s fine. I’ll just be a second.
654,Pepper,"Listen, it’s our position that Stark has and continues to maintain propriety ownership of the Mark II platform."
655,News reporter,"When Mr Stark announced he was indeed Iron Man, he was making a promise to America."
656,Pepper,"No, the suit belongs to us."
657,News reporter,We trusted that he would look out for us.
658,Pepper,"Yeah, but you’re not…"
659,News reporter,He obviously did not.
660,Pepper,Burt…
661,News reporter,And now we learn that his secretary…
662,Pepper,"Yes, it does."
663,News reporter,"…a woman named Virginia “Pepper” Potts, has been appointed as CEO of Stark Industries. What are her qualifications?"
664,Pepper,No.
665,News reporter,Miss Potts has done nothing to manage this terrible…
666,Tony,Mute.
667,Pepper,"No… Burt… Burt… Burt, listen to me. Don’t tell me that we have the best patent lawyers in the country and then not let me pursue this."
668,Tony,I’ll get this stuff out of here.
669,Pepper,"Well, then, tell the President to sign an order. We’ll talk about it at the Expo.  Hammer’s giving some presentation tomorrow evening. Will Tony Stark be there?"
670,Tony,Will I?
671,Pepper,"No, he will not. Bye."
672,Tony,I would like to be. Got a minute?
673,Pepper,No.
674,Tony,"Come on, you just got off the phone. You’re fine. 30 seconds."
675,Pepper,Twenty-nine Twenty-eight.
676,Tony,"I was just driving over here, and I thought I was coming to basically apologise, but I’m not."
677,Pepper,You didn’t come here to apologise?
678,Tony,"Look, that goes without saying, and I’m working on that. But I haven’t been entirely upfront with you, and I just want to try to make good. Can I move this? This is crazy. It’s like a Ferris wheel, going. I’m trying to get some…"
679,Pepper,No.
680,Tony,"Do you know how short life is? And if I never got to express… And by the way, this is somewhat revelatory to me. And I don’t care… I mean, I care. It would be nice. I’m not expecting you to… Look, here’s what I’m trying to say. I’m just gonna say it."
681,Pepper,"Let me stop you right here, okay? Because if you say “I” one more time, I’m gonna actually hurl something at your head, I think. I am trying to run a company. Do you have any idea what that entails?"
682,Tony,Yes.
683,Pepper,"People are relying on you to be Iron Man and you’ve disappeared, and all I’m doing is putting out your fires and taking the heat of it. I am trying to do the job that you were meant to do. Did you bring me strawberries? Did you know that there’s only one thing on Earth that I’m allergic to?"
684,Tony,Allergic to strawberries. This is progress Pepper. I knew there was a correlation between you and this.
685,Pepper,I need you…
686,Tony,I need you too.
687,Pepper,…to leave now
688,Tony,That’s what I’m trying to…
689,Natasha,Ms Potts?
690,Pepper,"Hi, come on in."
691,Natasha,Wheels up in 25 minutes.
692,Pepper,Thank you.
693,Happy,"Anything else, boss?"
694,Tony,"I’m good, Hap."
695,Pepper,"No, I’ll be just another minute."
696,Tony,"I lost both the kids in the divorce.  Are you blending in well here, Natalie? Here are Stark Enterprises? Your name is Natalie, isn’t it? I thought you two didn’t get along?"
697,Pepper,No. That’s not so.
698,Tony,It’s just me you don’t care for. No? Nothing?
699,Pepper,"Actually, while you’re here maybe you and Natalie could discuss the matter of the personal belongings."
700,Natasha,Absolutely.  I’m surprised you can keep your mouth shut.
701,Tony,"Boy, you’re good. You are mind-blowingly duplicitous. How do you do it? You just tear things… You’re a triple imposter. I’ve never seen anything like you. Is there anything real about you? Do you even speak Latin?"
702,Natasha,
703,Tony,Which means? Wait. What? What did you just say?
704,Natasha,It means you can either drive yourself home or I can have you collected.
705,Tony,You’re good. [Piles things up under desk spinny thing and throws strawberries in the bin. Goes back to the model and looks at it through one eye.
706,Tony,"Jarvis, could you kindly Vac-U-Form a digital wire frame? I need a manipulatable projection."
707,Jarvis,"1974 Stark Expo model scan complete, sir."
708,Tony,How many buildings are there?
709,Jarvis,Am I to include the Belgium waffle stands?
710,Tony,That was rhetorical. Just show me.  What does that look like to you Jarvis? Not unlike an atom. In which case the nucleus would be here. Highlight the unisphere. Lose the footpaths. Get rid of them.
711,Jarvis,"What is it you’re trying to achieve, sir?"
712,Tony,"I’m discovering… Correction. I’m rediscovering a new element, I believe. Lose the landscaping, the shrubbery, the trees."
713,Jarvis,The proposed element should serve as a viable replacement for palladium.
714,Tony,Thank Dad.
