,Character,Dialog
0,Tony Stark,"We create our own demons. Who said that? What does that even mean? Doesn't matter, I said it cause he said it. So now he was famous and that's basically get said by two well known guys. I don't, uh..."
1,Tony Stark,I'm gonna start again. Let's track this from the beginning.
2,Happy Hogan,Half hour till the ball drops.
3,Tony Stark,"Hey, do you want...?"
4,Party Guest,"Tony Stark? Great speech, man!"
5,Happy Hogan,"I got you, pal."
6,Tony Stark,I gave a speech? How was it?
7,Happy Hogan,Pitiful
8,Maya Hansen,Unintelligible.
9,Tony Stark,Really?
10,Maya Hansen,Mmm-hmm.
11,Tony Stark,"It's my favorite kind, a winning combo."
12,Maya Hansen,Where are we going?
13,Tony Stark,"Uh, to town on each other, probably back in your room. Cause I also wanna see your research."
14,Maya Hansen,"Okay, you can see my research, but that's...I'm not gonna show you my ""town."""
15,Ho Yinsen,Mr. Stark
16,Tony Stark,"Oh, I finally met a man called ""Ho."""
17,Ho Yinsen,"I would like to introduce you to our guest, Dr. Wu."
18,Tony Stark,"Oh, this guy."
19,Ho Yinsen,Mr. Stark.
20,Tony Stark,Hey.
21,Maya Hansen,Bye.
22,Ho Yinsen,Perhaps another time.
23,Tony Stark,"It started in Bern, Switzerland, 1999."
24,Aldrich Killian,Mr. Stark!
25,Tony Stark,I never thought they'd come back to bite me. Why would they?
26,Aldrich Killian,"Oh, wow! Hey, Tony! Aldrich Killian.  I'm a big fan of your work!"
27,Maya Hansen,My work?
28,Tony Stark,Who isn't? He means me.
29,Aldrich Killian,"Well, of course. But, Miss Hansen, my organization has been tracking your research since year two of MIT."
30,Happy Hogan,"Yeah, we're full."
31,Tony Stark,"Oh, wow. He made it. He made the cut."
32,Happy Hogan,"What floor are you going to, pal?"
33,Aldrich Killian,"Oh, now, that is an appropriate question. The ground floor, actually. I've got a proposal I'm putting together with myself. It's a privately funded think tank called, Advanced Idea Mechanics."
34,Tony Stark,Uh... she'll take both.
35,Maya Hansen,Okay.
36,Tony Stark,One to throw away and one to not call.
37,Aldrich Killian,"Advanced Idea Mechanics, or AIM for short.  Do you get it?"
38,Tony Stark,"I see that, cause it's on your t-shirt."
39,Aldrich Killian,Aw!
40,Tony Stark,Ladies first.
41,Maya Hansen,"Thank you, I'll call you."
42,Tony Stark,I'm titillated by the notion of working with you.
43,Aldrich Killian,Yeah?
44,Tony Stark,"Yeah, cheese clown. I'll see you up on the roof in five minutes.  I'm just going to try to get my beef wet real quick. You know what I'm talkin' about?"
45,Aldrich Killian,I'll see you up there.
46,Tony Stark,Damn betcha.
47,Tony Stark,Come on! I thought that was just a theory.
48,Maya Hansen,"Well, it was. If I'm right, we can access the area of the brain that governs repair..."
49,Tony Stark,Wow.
50,Maya Hansen,...And chemically recode it.
51,Tony Stark,That's incredible. Essentially you're hacking into the genetic...
52,Both,...Genetic operating system...
53,Tony Stark,...of a...
54,Maya Hansen,Exactly.
55,Tony,...living organism.
56,Maya Hansen,Yes.
57,Tony Stark,Wow.
58,Maya Hansen,Is that... Can you...
59,Happy Hogan,What?
60,Maya Hansen,Can you not touch my plant. It's not...she doesn't like it. She prefers...
61,Tony Stark,She's not like the others.​​​​​​  Come on. Let's go in the bedroom. Happy...
62,Maya Hansen,"That's cute, but..."
63,Tony Stark,Leave her ficus alone.
64,Maya Hansen,
65,Tony Stark,And you're starting with plants?
66,Maya Hansen,"For now, yeah."
67,Tony Stark,Huh.
68,Maya Hansen,I'm calling it Extremis.
69,Maya Hansen,"Well, it's..."
70,Both,Human application.
71,Maya Hansen,Exactly! Exactly.
72,Maya Hansen,Dendritic revitalization.
73,Tony Stark,It's revolutionary.
74,Maya Hansen,Disease prevention...
75,Tony Stark,Changes the world.
76,Maya Hansen,...even limb regrowth.
77,Tony Stark,You're the most gifted woman I've ever met.
78,Maya Hansen,Wow.
79,Tony Stark,In Switzerland.
80,Maya Hansen,"Hmm, that's better. Aw, you're seeing things."
81,Tony,This week.
82,Tony Stark,"You almost bought it, didn't you?"
83,Maya Hansen,"This is what I'm talking about, the glitch."
84,Tony Stark,Have you checked the telomerase algorithm?
85,Maya Hansen,The what?
86,Happy Hogan,"Down! Stay down! Stay down, boss."
87,Tony Stark,We're good.
88,Happy Hogan,Stay down.
89,Tony Stark,You're...you're right on me. I made it.  What the hell was that?
90,Happy Hogan,What was that?
91,Maya Hansen,It's a glitch in my work. It's...
92,Tony Stark,She was just talking about it. Glitches happening.
93,Happy Hogan,It's not Y2K.
94,Maya Hansen,No.
95,Tony Stark,Hey!
96,Happy Hogan,Happy New Year.
97,Tony Stark,Happy New Year.
98,Maya Hansen,Happy New Year.
99,Tony Stark,"Alright, I'll see you in the morning, goodnight."
100,Happy Hogan,You good?
101,Tony Stark,Yep.
102,Happy Hogan,I'll be right outside.
103,Tony Stark,Okay.
104,Tony Stark,"So why am I telling you this? Because I had just created demons, and I didn't even know it."
105,Tony Stark,"Yeah, those were the good times. Then I moved on. After a brief soiree in an Afghan cave, I said goodbye to the party scene. Forgot that night in Switzerland. These days I'm a changed man, I'm different now. I'm well... you know who I am."
106,Tony Stark,Ow!
107,JARVIS,"Sir, please may I request just a few hours to calibrate..."
108,Tony Stark,No. Forty-eight.  Ah! Micro-repeater implanting sequence complete.
109,JARVIS,"As you wish, sir. I've also prepared a safety briefing for you to entirely ignore."
110,Tony Stark,"Which I will. Right, let's do this."
111,Tony Stark,"Dummy. Hi, Dummy. How did you get that cap on your head? You earned it."
112,Tony Stark,"Hey. Hey! What are you doing round in the corner? You know what you did. Blood on my mat, handle it."
113,JARVIS,"Sir, may I remind you that you've been awake for nearly seventy-two hours."
114,Tony Stark,"Focus up, ladies. Good evening, and welcome to the birthing suite. I'm pleased to announce the imminent arrival of your bouncing, bad-ass, baby brother."
115,Tony Stark,"Start tight and go wide, stamp in time. Mark 42 autonomous prehensile propulsion suit test. Initialize sequence."
116,Tony Stark,"Jarvis, drop my needle."
117,Tony Stark,Crap.
118,Tony Stark,"Alright, I think we got this. Send 'em all."
119,Tony Stark,"Probably a little fast, slow it down. Slow it down just a..."
120,Tony Stark,...little bit.
121,Tony Stark,"Cool it, will you, Jarvis?"
122,Tony Stark,Come on. I ain't scared of you.
123,Tony Stark,I'm the best.
124,JARVIS,"As always, sir, a great pleasure watching you work."
125,Tony Stark,And I guess seventy-two hours isn't a long time between siesta's. Didn't think it could get any worse. Then I had to go and turn on the TV.
126,Tony Stark,That's when he happened.
127,The Mandarin,"Some people call me a terrorist, I consider myself a teacher. America, ready for another lesson. In 1864 in Sand Creek Colorado the U.S. military waited till the friendly Cheyenne braves all gone hunting, waited to attack and slaughter their families left behind, and claim their land. Thirty-nine hours ago the Ali Al Salem Air Base in Kuwait was attacked. I...I...I did that. A quaint military church filled with wives and children, of course. The soldiers were out on maneuvers, the braves were away. President Ellis, you continue to resist my attempts to educate you, sir. And now, you've missed me again. You know who I am, you don't know where I am, and you'll never see me coming."
128,News Reporter #1,"And now that we seem to be back, let's recap some of the frightening..."
129,News Reporter #2,American Airwaves were highjacked...
130,News Reporter #3,The nation remains on high alert...
131,News Reporter #4,All attempts to find the Mandarin have so far proved unsuccessful...
132,President Ellis,"Central to my Administration's response to this terrorist event, is a newly minted resource. I know him as Colonel James Rhodes, the American people will soon know him as the Iron Patriot."
133,Bill Maher,And how is President Ellis responding? By taking the guy they call War Machine and giving him a paint job.
134,Joan Rivers,"Same suit, but painted red, white, and blue. Look at rhat. And they also renamed him Iron Patriot. You know, just in case the paint was too subtle."
135,Colonel James Rhodes,"It tested well with focus groups, alright?"
136,Tony Stark,I am Iron Patriot...
137,Colonel James Rhodes,"Listen, War Machine was a little too aggressive, alright? This sends a better message."
138,Tony Stark,"So what's really goin' on? With Mandarin. Seriously, can we talk about this guy?"
139,Colonel James Rhodes,"It's classified information, Tony. Okay, there have been nine bombings."
140,Tony Stark,Nine.
141,Colonel James Rhodes,"The public only knows about three. Here's the thing, nobody can ID a device. There's no bomb casings."
142,Tony Stark,"You know I can help, just ask. I got a ton of new tech, I got a prehensile, I got a...I got a new bomb disposal. Catches explosions mid-air."
143,Colonel James Rhodes,When's the last time you got a good night's sleep?
144,Tony Stark,Einstein slept three hours a year. Look what he did?
145,Colonel James Rhodes,"People are concerned about you, Tony. I'm concerned about you."
146,Tony Stark,You're gonna come at me like that?
147,Colonel James Rhodes,"No. No, look, I'm not trying to be a dic..."
148,Colonel James Rhodes,...tator.
149,Erin,Do you mind signing my drawing?
150,Tony Stark,"If Richard doesn't mind.  You alright with this, Dick?"
151,Colonel James Rhodes,Fine with me.
152,Tony Stark,What's your name?
153,Erin,Erin.
154,Tony Stark,"I loved you in A Christmas Story, by the way."
155,Colonel James Rhodes,"Listen, the Pentagon is scared. After what happened in New York... aliens, come on. They need to look strong. Stopping the Mandarin is priority, but it's not..."
156,Tony Stark,"It's not superhero business, I get it."
157,Colonel James Rhodes,"No, it's not, quite frankly. It's American business."
158,Tony Stark,That's why I said I...got it.
159,Colonel James Rhodes,Are you okay?
160,Tony Stark,I broke the crayon.
161,Erin,"Are you okay, Mr. Stark?"
162,Colonel James Rhodes,Take it easy. Tony...
163,Little Boy,How did you get out of the wormhole? How did you get out of the wormhole?
164,Colonel James Rhodes,Wait a minute! Tony!
165,Tony Stark,What'd he say?!
166,Colonel James Rhodes,Tony!
167,Tony Stark,Sorry. Have to check on the suit...make sure...okay.
168,Tony Stark,"Check the heart, check the...check the...is it the brain?"
169,JARVIS,No sign of cardiac analomy or unusual brain activity.
170,Tony Stark,"Okay, so I was poisoned?"
171,Jarvis,My diagnosis is that you've experienced a severe anxiety attack.
172,Tony Stark,Me?
173,Colonel James Rhodes,"Come on, man. This isn't a good look, open up."
174,Tony Stark,"Sorry, I gotta split."
175,Happy Hogan,"Badge. Badge. Come on, badge. Badge, guys. I put a memo in the toilet, come on.  Tony has got them in his basement, they're wearing party hats. This is an asset that we can put to use."
176,Pepper Potts,"Uh-huh. So, you're suggesting that I replace the entire janitorial staff with robots?"
177,Happy Hogan,What I'm saying is that the human element of Human Resources is our biggest point of vulnerability. We should start phasing it out immediately.
178,Pepper Potts,What!?
179,Happy Hogan,"Excuse me, Bambi."
180,Pepper Potts,Did you just say that?
181,Happy Hogan,Security.
182,Pepper Potts,Happy?
183,Happy Hogan,Yes.
184,Pepper Potts,"Okay, I am thrilled that you're now the Head of Security, okay? It is the perfect position for you."
185,Happy Hogan,Thank you.
186,Pepper Potts,However...
187,Happy Hogan,I do appreciate it
188,Pepper Potts,Since you've taken the post...
189,Happy Hogan,You don't have to thank me.
190,Pepper Potts,We've had a rise in staff complaints of three hundred percent
191,Happy Hogan,Thank you.
192,Pepper Potts,That's not a compliment.
193,Happy Hogan,That's not a compli...? It is a compliment! Clearly somebody's trying to hide something.
194,Pepper Potts,I...
195,Pepper's Assistant,Excuse me.
196,Pepper Potts,Yes?
197,Pepper's Assistant,"Miss Potts, your four o'clock is here."
198,Pepper Potts,Thank you.
199,Happy Hogan,Did you clear this four o'clock with me?
200,Pepper Potts,"Happy, we'll talk about this later. But right now I have to go deal with this very annoying thing."
201,Happy Hogan,How so?
202,Pepper Potts,"I used to work with him, and he used to ask me out all the time. So it's a little awkward."
203,Happy Hogan,I don't like the sound of that.
204,Aldrich Killian,Pepper.
205,Pepper Potts,Killian?
206,Aldrich Killian,You look great. You look really great.
207,Pepper Potts,"God, you look...you look great. I... I...I can't... What on earth have you been doing?"
208,Aldrich Killian,"Nothing fancy, just five years in the hands of physical therapists. And please, call me Aldrich."
209,Happy Hogan,Uh...you were supposed to be issued a security badge.
210,Pepper Potts,"Happy, it's okay."
211,Happy Hogan,Yes?
212,Pepper Potts,We're good.
213,Happy Hogan,You sure?
214,Pepper Potts,Yes. Stand down.
215,Happy Hogan,"Okay. I'm gonna linger, right here."
216,Pepper Potts,Thank you.
217,Happy Hogan,Okay.
218,Pepper Potts,"It's very nice to see you, Killian."
219,Happy Hogan,"Hey, guy."
220,Savin,Merry Christmas.
221,Aldrich Killian,"After years dodging the President's ban on ""immoral biotech research"", my think tank now has a little something in the pipeline. It's an idea we like to call Extremis. I'm gonna turn your lights down."
222,Aldrich Killian,Regard the human brain.
223,Aldrich Killian,"Uh...wait. Hold on, hold on. That's...that's the universe, my bad. But if I do that..."
224,Aldrich Killian,"That's the brain. Strangely mimetic though, wouldn't you say?"
225,Aldrich Killian,"Thanks, it's mine."
226,Pepper Potts,What?
227,Aldrich Killian,This...you're inside my head. It's a...
228,Aldrich Killian,"It's a live feed. Come on up, I'll prove it to you."
229,Aldrich Killian,Come on.
230,Aldrich Killian,"Now, pinch my arm. I can take it. Pinch me."
231,Pepper Potts,What is that?
232,Aldrich Killian,It's the primary somatosensory cortex. It's the brain's pain center. But this is what I wanted to show you.
233,Aldrich Killian,"Now, Extremis harnesses our bioelectrical potential and it goes...here. This is essentially an empty slot, and what this tells us is that our mind, our entire DNA in fact, is destined to be upgraded."
234,Pepper Potts,Wow.
235,Happy Hogan,Hello?
236,Tony Stark,Is this forehead of Security?
237,Happy Hogan,"What? You know, look, I got a real job. What do you want? I'm working, I got something going on here."
238,Tony Stark,What? Harassing interns?
239,Happy Hogan,"Let me tell you something, you know what happened when I told people I was Iron Man's body guard? They would laugh in my face."
240,Happy Hogan,"I had to leave while I still had a shred of dignity. Now I got a real job, I'm watching Pepper."
241,Tony Stark,What's going on? Fill me in.
242,Happy Hogan,For real?
243,Tony Stark,Yeah.
244,Happy Hogan,"Alright, so she's meeting up with this scientist. Rich guy, handsome."
245,Tony Stark,Right.
246,Happy Hogan,"I couldn't make his face at first, right? You know I'm good with faces."
247,Tony Stark,"Oh, Yeah, yeah. You're the best."
248,Happy Hogan,"Yeah. Well, so I run his credentials, I make him Aldrich Killian. We actually met the guy back in... where were we in '99? The science conference?"
249,Tony Stark,Um...Switzerland.
250,Happy Hogan,"Right, right, exactly."
251,Tony Stark,"Killian? No, I don't remember that guy."
252,Happy Hogan,"Of course you don't. He's not a blond with a big rack. At first it was fine, they were talking business, but now it's like getting weird. He's showing her a big brain."
253,Tony Stark,His what?
254,Happy Hogan,"Big brain, and she likes it. Here, let me show you. Hold on. See?"
255,Tony Stark,Look at what? You watching them? Flip the screen and then we can get started.
256,Happy Hogan,"I'm not a tech genius like you. Just...just trust me, get down down here."
257,Tony Stark,"Flip the screen, then I can see what they're doing."
258,Happy Hogan,I can't! I don't know how to flip the screen! Don't talk to me like that anymore. You're not my boss.
259,Happy Hogan,"Alright, I don't work for you. Now I don't trust this guy. He's got another guy with him, he's shifty."
260,Tony Stark,Relax.
261,Happy Hogan,Seriously?
262,Tony Stark,I'm just asking you to secure the perimeter. Tell him to go out for a drink or something?
263,Happy Hogan,"You know what? You should take more of an interest in what's going on here. This woman... this woman's the best thing that ever happened to you, and you...you're just ignoring her."
264,Tony Stark,A giant brain?
265,Happy Hogan,"Yeah, there's a giant brain, there's a shifty character. I'm gonna follow this guy. I'm gonna run his plates and if it gets rough, so be it."
266,Tony Stark,"I miss you, Happy."
267,Happy Hogan,"Yeah, I miss you too. But the way it used to be. Now you're off with the 'superfriends', I don't know what's going on with you anymore. The world's getting weird..."
268,Tony Stark,"Hey, I...I'd hate to cut you off. Do you have your taser on you?"
269,Happy Hogan,Why?
270,Tony Stark,"I think there's a gal in HR who's trying to steal some printer ink, you should probably go over there and zap her."
271,Happy Hogan,"Yeah, nice."
272,Aldrich Killian,Imagine if you could hack into the hard drive of any living organism and recode its DNA.
273,Pepper Potts,It would be incredible.
274,Aldrich Killian,Mm.
275,Pepper Potts,"Unfortunately, to my ears it also sounds highly weaponizable. As in enhanced soldiers, private armies, and Tony is not..."
276,Aldrich Killian,"Tony. Tony. You know, I invited Tony to join AIM thirteen years ago, he turned me down. But something tells me now there is a new genius on the throne who doesn't have to answer to Tony anymore, and who has slightly less of an ego."
277,Pepper Potts,"It's gonna be a no, Aldrich. As much as I'd like to help you."
278,Aldrich Killian,"Well, I can't say that I'm not disappointed. But then as my father used to say, 'Failure is the fog through which we glimpse triumph.'"
279,Pepper Potts,That's very deep.
280,Aldrich Killian,Mm
281,Pepper Potts,And I have no idea what it means.
282,Aldrich Killian,"Well, me neither. He was kind of an idiot, my old man."
283,Aldrich Killian,"I'm sure I'll see you again, Pepper."
284,Pepper Potts,Happy...
285,Happy Hogan,"The car is ready, if you're ready to go."
286,Pepper Potts,"Yes. I just um... God, I forgot my... other thing, so... I'm just gonna..."
287,Pepper Potts,I'm sorry I'm late. I was... What the...? What is that?!
288,Pepper Potts,"You're wearing this in the house now? What is that, like Mark 15?"
289,Tony Stark,Uh...yeah. Something like that. You know everybody needs a hobby.
290,Pepper Potts,"Oh, and you have to wear your hobby in the living room?"
291,Tony Stark,"Just breakin' it in. You know, it's always a little pinchy in the gooey bag at first, so."
292,Tony Stark,"Oh hey, did you see your Christmas present?"
293,Pepper Potts,"Yes, I did. I...I don't know how I could have missed that Christmas present. Is it gonna fit through the door?"
294,Tony Stark,"Well actually, uh...it's a good question. I got a team of guys comin' tomorrow, they're gonna blow out that wall."
295,Pepper Potts,Okay.
296,Tony Stark,"So, uh...tense? Good day?"
297,Tony Stark,"Ooh shoulders, a little naughty. Naughty girl. I don't wanna harp on this, but did you like the custom rabbit?"
298,Pepper Potts,Did I like it?
299,Tony Stark,"Nailed it, right?"
300,Pepper Potts,Wow. I appreciate the thought very much.
301,Pepper Potts,So why don't you lift up that face mask and give me a kiss?
302,Tony Stark,"Huh. Yup, dammit. No can do. You wanna just kiss it on the..."
303,Pepper Potts,Uh-huh.
304,Tony Stark,The facial slit?
305,Pepper Potts,"Well, why don't I run down to the garage and see if I can't find a crowbar to shimmy that thing open?"
306,Tony Stark,Crowbar. Yeah.
307,Tony Stark,"Oh, except there's been a...uh...a radiation leak."
308,Pepper Potts,I'll take my chances.
309,Tony Stark,That's risky.
310,Tony Stark,At least let me get you like a Hazmat suit or a Geiger counter or something like that.
311,Tony Stark,Busted.
312,Pepper Potts,This is a new level of lame.
313,Tony Stark,Sorry.
314,Pepper Potts,"You ate without me, already? On date night?"
315,Tony Stark,He was just...
316,Pepper Potts,You mean you?
317,Tony Stark,"Well, yeah. I just mean we were just...just hosting you while I finished up a little work."
318,Pepper Potts,Uh-huh.
319,Tony Stark,"And yes, I had a quick bite. I didn't know if you were comin' home or if you were having drinks with Aldrich Killian."
320,Pepper Potts,What?
321,Tony Stark,What?
322,Pepper Potts,Aldrich Killian? What are you checking up on me?
323,Tony Stark,Happy was concerned.
324,Pepper Potts,"No, you're spying on me."
325,Tony Stark,I wasn't...
326,Pepper Potts,I'm going to bed.
327,Tony Stark,Hold on. Come on. Pep.
328,Tony Stark,"Hey, I admit it! My fault. Sorry."
329,Tony Stark,"I'm a piping hot mess. It's been going on for a while, I haven't said anything."
330,Tony Stark,Nothing's been the same since New York.
331,Pepper Potts,"Oh really? Well, I didn't notice that, at all."
332,Tony Stark,"You experience things and then they're over and you still can't explain 'em. Gods, aliens, other dimensions. I...I'm just a man in a can. The only reason I haven't cracked up is probably because you moved in. Which is great. I love you, I'm lucky. But, honey, I can't sleep. You go to bed, I come down here. I do what I know, I tinker."
333,Tony Stark,"But threat is imminent, and I have to protect the one thing that I can't live without. That's you. My suits, they're uh..."
334,Pepper Potts,Machines.
335,Tony Stark,They're part of me.
336,Pepper Potts,A distraction.
337,Tony Stark,Maybe.
338,Pepper Potts,I'm gonna take a shower.
339,Tony Stark,Okay.
340,Pepper Potts,And you're gonna join me.
341,Tony Stark,Better.
342,Pepper Potts,Tony! Tony! Tony! Tony...
343,Tony Stark,Power down!
344,Tony Stark,"I must have called it in my sleep. That's not supposed to happen. I'll recalibrate the sensors. Can we just...just let me...just let me catch my breath, okay?"
345,Tony Stark,"Don't go, alright? Pepper?"
346,Pepper Potts,I'm going to sleep downstairs. Tinker with that.
347,Savin,Can you regulate?
348,Taggert,"Yes, I can regulate."
349,Savin,Are you sure about that?
350,Taggert,Yes.
351,Savin,It's a decent batch. Don't say I never did nothin' for you.
352,Taggert,Thank you...I mean for understanding.
353,Happy Hogan,"I'm sorry, buddy."
354,Savin,"What are you doin', buddy? You out by yourself? A little date night? Watching your favorite chick flick maybe?"
355,Happy Hogan,"Yeah, a little movie called ""The Party's Over"", starring you and your junkie girlfriend, and here's the ticket."
356,Savin,No kidding? That doesn't belong to you.
357,Taggert,Savin!
358,Savin,What?
359,Taggert,Help! Help me!
360,The Mandarin,"True story about fortune cookies. They look Chinese, they sound Chinese, but they're actually an American invention. Which is why they're hollow, full of lies, and leave a bad taste in the mouth. My disciples just destroyed another cheap American knock-off, The Chinese Theater. Mr. President, I know this must be getting frustrating, but this season of terror is drawing to a close. And don't worry, the big one is coming; your graduation."
361,Tony Stark,Hi.
362,Happy's Nurse,Oh.
363,Tony Stark,Uh...mind leaving that on?
364,Happy's Nurse,Sure.
365,Tony Stark,"Sunday night's PBS 'Downtown Abbey'. That's his show, he thinks it's elegant."
366,Hospital News Reporter,We're awaiting the arrival of Tony Stark. We're hoping he'll give us the reaction...his reaction to the latest attack.
367,Pushy Tabloid Reporter,"Hey, Mr. Stark! When is somebody gonna kill this guy? Just sayin'."
368,Tony Stark,"Is that what you want? Here's a little Holiday greeting I've been wanting to send to the Mandarin. I just didn't know how to phrase it until now. My name is Tony Stark and I'm not afraid of you. I know you're a coward, so I've decided"
369,JARVIS,"I've compiled a Mandarin database for you, sir. Drawn from S.H.I.E.L.D., F.B.I., and C.I.A. intercepts. Initiating virtual crime scene reconstruction."
370,Tony Stark,"Okay, what do we got here? His name is an ancient Chinese war mantle, meaning ""adviser to the King"". South American insurgency tactics, talks like a Baptist preacher. There's lots of pageantry going on here...lots of theater."
371,JARVIS,The heat from the blast was in excess of 3000 degrees Celsius. Any subjects within 12.5 yards were vaporized instantly.
372,Tony Stark,No bomb parts found in a three mile radius of the Chinese theater.
373,JARVIS,"No, sir."
374,Tony Stark,"Talk to me, Happy.  Any military victims?"
375,JARVIS,"Not according to public records, sir."
376,Tony Stark,"Bring up the thermogenic signatures again, factor in three thousand degrees."
377,JARVIS,The oracle cloud has completed analysis. Accessing satellites and plotting the last twelve months of thermogenic occurrence now.
378,Tony Stark,Take away everywhere that there's been a Mandarin attack.  That. You sure that's not one of his?
379,JARVIS,It predates any known Mandarin attack. The incident was the use of a bomb to assist a suicide.
380,Tony Stark,Bring her around.
381,JARVIS,The heat signature is remarkably similar. Three thousand degrees Celsius.
382,Tony Stark,"That's two military guys. Ever been to Tennessee, Jarvis?"
383,JARVIS,Creating a flight plan for Tennessee.
384,Tony Stark,"Are we still at ""ding-dong""? We're supposed to be on total security lock down. Come on, I threatened a terrorist. Who is that?"
385,JARVIS,"There's only so much I can do, sir, when you give the world's press your home address."
